0,1,2,3
15636,ДОЛЯ ДЕТЕЙ ОХВАЧЕННЫХ ДОПОЛНИТЕЛЬНЫМИ ОБРАЗОВАТЕЛЬНЫМИ ПРОГРАММАМИ В ОБЩЕЙ ЧИСЛЕННОСТИ ДЕТЕЙ И МОЛОДЕЖИ ОТ ДО ЛЕТ,"['доля_NOUN', 'ребенок_NOUN', 'охватывать_VERB', 'дополнительный_ADJ', 'образование_NOUN', 'программа_NOUN', 'общий_ADJ', 'численность_NOUN', 'ребенок_NOUN', 'молодежь_NOUN', 'год_NOUN']",43
15643,ДОЛЯ РАБОТНИКОВ УДОД ПРИНЯВШИХ УЧАСТИЕ В МЕРОПРИЯТИЯХ ПО ОБМЕНУ ОПЫТОМ РАБОТЫ С ДРУГИМИ ГОРОДАМИ РЕГИОНАМИ ПО РАЗЛИЧНЫМ АСПЕКТАМ ДЕЯТЕЛЬНОСТИ УДОД И МОДЕРНИЗАЦИИ СФЕРЫ ДОПОЛНИТЕЛЬНОГО ОБРАЗОВАНИЯ ДЕТЕЙ,"['доля_NOUN', 'работник_NOUN', 'удод_NOUN', 'принимать_VERB', 'участие_NOUN', 'мероприятие_NOUN', 'обмен_NOUN', 'опыт_NOUN', 'работа_NOUN', 'город_NOUN', 'регион_NOUN', 'различный_ADJ', 'аспект_NOUN', 'деятельность_NOUN', 'удод_NOUN', 'модернизация_NOUN', 'сфера_NOUN', 'дополнительный_ADJ', 'образование_NOUN', 'ребенок_NOUN']",-1
15644,СООТНОШЕНИЕ УРОВНЯ ОПЛАТЫ ТРУДА ПЕДАГОГОВ ОРГАНИЗАЦИЙ ДОПОЛНИТЕЛЬНОГО ОБРАЗОВАНИЯ И СРЕДНЕЙ ЗАРАБОТНОЙ ПЛАТЫ,"['соотношение_NOUN', 'уровень_NOUN', 'оплата_NOUN', 'труд_NOUN', 'педагог_NOUN', 'организация_NOUN', 'дополнительный_ADJ', 'образование_NOUN', 'среднее_NOUN', 'заработный_ADJ', 'плата_NOUN']",-1
15658,ДОЛЯ ДЕТЕЙ В ВОЗРАСТЕ ЛЕТ ОХВАЧЕННЫХ ПРОГРАММАМИ ДОПОЛНИТЕЛЬНОГО ОБРАЗОВАНИЯ ДЕТЕЙ В ОБЩЕЙ ЧИСЛЕННОСТИ ДЕТЕЙ В ВОЗРАСТЕ ЛЕТ ПРОЦЕНТОВ,"['доля_NOUN', 'ребенок_NOUN', 'возраст_NOUN', 'год_NOUN', 'охватывать_VERB', 'программа_NOUN', 'дополнительный_ADJ', 'образование_NOUN', 'ребенок_NOUN', 'общий_ADJ', 'численность_NOUN', 'ребенок_NOUN', 'возраст_NOUN', 'год_NOUN', 'процент_NOUN']",19
15676,ДОЛЯ ОРГАНИЗАЦИЙ ДОПОЛНИТЕЛЬНОГО ОБРАЗОВАНИЯ ВНЕДРИВШИХ ЭФФЕКТИВНЫЙ КОНТРАКТ С РУКОВОДИТЕЛЕМ ПРОЦЕНТ,"['доля_NOUN', 'организация_NOUN', 'дополнительный_ADJ', 'образование_NOUN', 'внедрение_NOUN', 'эффект_NOUN', 'контракт_NOUN', 'руководитель_NOUN', 'процент_NOUN']",4
15701,ОТНОШЕНИЕ СРЕДНЕМЕСЯЧНОЙ ЗАРАБОТНОЙ ПЛАТЫ ПЕДАГОГИЧЕСКИХ РАБОТНИКОВ ОРГАНИЗАЦИЙ ДОПОЛНИТЕЛЬНОГО ОБРАЗОВАНИЯ ДЕТЕЙ К СРЕДНЕМЕСЯЧНОЙ ЗАРАБОТНОЙ ПЛАТЕ УЧИТЕЛЕЙ В КРАСНОДАРСКОМ КРАЕ,"['отношение_NOUN', 'среднемесячный_ADJ', 'заработный_ADJ', 'плата_NOUN', 'педагогический_ADJ', 'работник_NOUN', 'организация_NOUN', 'дополнительный_ADJ', 'образование_NOUN', 'ребенок_NOUN', 'среднемесячный_ADJ', 'заработный_ADJ', 'плата_NOUN', 'учитель_NOUN', 'край_NOUN']",17
15713,УВЕЛИЧЕНИЕ КОЛИЧЕСТВА УЧАЩИХСЯ В УЧРЕЖДЕНИЯХ ДОПОЛНИТЕЛЬНОГО ОБРАЗОВАНИЯ ДЕТЕЙ В СФЕРЕ КУЛЬТУРЫ ПРИНЯВШИХ УЧАСТИЕ В ТВОРЧЕСКИХ КОНКУРСАХ ФЕСТИВАЛЯХ ВЫСТАВКАХ РАЗЛИЧНЫХ УРОВНЕ ПО ОТНОШЕНИЮ К ГОДУ,"['увеличение_NOUN', 'количество_NOUN', 'учащийся_NOUN', 'учреждение_NOUN', 'дополнительный_ADJ', 'образование_NOUN', 'ребенок_NOUN', 'сфера_NOUN', 'культура_NOUN', 'принимать_VERB', 'участие_NOUN', 'творческий_ADJ', 'конкурс_NOUN', 'фестиваль_NOUN', 'выставка_NOUN', 'различный_ADJ', 'уровень_NOUN', 'отношение_NOUN', 'год_NOUN']",-1
15742,ПОВЫШЕНИЕ УДОВЛЕТВОРЕННОСТИ НАСЕЛЕНИЯ РАЙОНА КАЧЕСТВОМ УСЛУГ ДОПОЛНИТЕЛЬНОГО ОБРАЗОВАНИЯ ДЕТЕЙ,"['повышение_NOUN', 'удовлетворенность_NOUN', 'население_NOUN', 'район_NOUN', 'качество_NOUN', 'услуга_NOUN', 'дополнительный_ADJ', 'образование_NOUN', 'ребенок_NOUN']",-1
15752,ДОЛЯ ЖИТЕЛЕЙ РАЙОНА ЗАНИМАЮЩИХСЯ В ЛЮБИТЕЛЬСКИХ ОБЪЕДИНЕНИЯХ И КРУЖКАХ ОТ ОБЩЕГО ЧИСЛА ЖИТЕЛЕЙ РАЙОНА,"['доля_NOUN', 'житель_NOUN', 'район_NOUN', 'заниматься_VERB', 'любительский_ADJ', 'объединение_NOUN', 'кружок_NOUN', 'общий_ADJ', 'число_NOUN', 'житель_NOUN', 'район_NOUN']",-1
15755,КОЛИЧЕСТВО ПРОВОДИМЫХ МЕРОПРИЯТИЙ ПО НАПРАВЛЕНИЯМ ДЕТСКОГО ТВОРЧЕСТВА ПО ПРЕЗЕНТАЦИИ ДОСТИЖЕНИЙ ОБУЧАЮЩИХСЯ В СФЕРЕ ДОПОЛНИТЕЛЬНОГО ОБРАЗОВАНИЯ ОХВАТ ДЕТЕЙ ОТ ДО ЛЕТ,"['количество_NOUN', 'проводы_NOUN', 'мероприятие_NOUN', 'направление_NOUN', 'детский_ADJ', 'творчество_NOUN', 'презентация_NOUN', 'достижение_NOUN', 'обучающийся_NOUN', 'сфера_NOUN', 'дополнительный_ADJ', 'образование_NOUN', 'охват_NOUN', 'ребенок_NOUN', 'год_NOUN']",-1
15757,ДОЛЯ ДЕТЕЙ ОХВАЧЕННЫХ ДОПОЛНИТЕЛЬНЫМ ОБРАЗОВАНИЕМ ПРИНЯВШИХ УЧАСТИЕ В РАЙОННЫХ МЕРОПРИЯТИЯХ КОНКУРСАХ ФЕСТИВАЛЯХ ВЫСТАВКАХ,"['доля_NOUN', 'ребенок_NOUN', 'охватывать_VERB', 'дополнительный_ADJ', 'образование_NOUN', 'принимать_VERB', 'участие_NOUN', 'районный_ADJ', 'мероприятие_NOUN', 'конкурс_NOUN', 'фестиваль_NOUN', 'выставка_NOUN']",-1
15780,УДЕЛЬНЫЙ ВЕС ЧИСЛЕННОСТИ РУКОВОДИТЕЛЕЙ МУНИЦИПАЛЬНЫХ ДО ООО И ОРГАНИЗАЦИЙ ДОПОЛНИТЕЛЬНОГО ОБРАЗОВАНИЯ ПРОШЕДШИХ В ТЕЧЕНИЕ ПОСЛЕДНИХ ТРЕХ ЛЕТ ПОВЫШЕНИЕ КВАЛИФИКАЦИИ ИЛИ ПРОФЕССИОНАЛЬНУЮ ПЕРЕПОДГОТОВКУ В ОБЩЕЙ ЧИСЛЕННОСТИ РУКОВОДИТЕЛЕЙ ДО ООО И ОРГАНИЗАЦИЙ ДОПОЛНИТЕЛЬНОГО ОБРАЗОВАНИЯ,"['удельный_ADJ', 'вес_NOUN', 'численность_NOUN', 'руководитель_NOUN', 'муниципальный_ADJ', 'ооо_NOUN', 'организация_NOUN', 'дополнительный_ADJ', 'образование_NOUN', 'проходить_VERB', 'течение_NOUN', 'последний_ADJ', 'год_NOUN', 'повышение_NOUN', 'квалификация_NOUN', 'профессиональный_ADJ', 'переподготовка_NOUN', 'общий_ADJ', 'численность_NOUN', 'руководитель_NOUN', 'ооо_NOUN', 'организация_NOUN', 'дополнительный_ADJ', 'образование_NOUN']",-1
15785,ДЕТЕЙ В ВОЗРАСТЕ ОТ ДО ЛЕТ ПРОГРАММАМИ ДОПОЛНИТЕЛЬНОГО ОБРАЗОВАНИЯ УДЕЛЬНЫЙ ВЕС ЧИСЛЕННОСТИ ДЕТЕЙ ПОЛУЧАЮЩИХ УСЛУГИ ДОПОЛНИТЕЛЬНОГО ОБРАЗОВАНИЯ В ОБЩЕЙ ЧИСЛЕННОСТИ ДЕТЕЙ В ВОЗРАСТЕ ОТ ДО ЛЕТ,"['ребенок_NOUN', 'возраст_NOUN', 'год_NOUN', 'программа_NOUN', 'дополнительный_ADJ', 'образование_NOUN', 'удельный_ADJ', 'вес_NOUN', 'численность_NOUN', 'ребенок_NOUN', 'получение_NOUN', 'услуга_NOUN', 'дополнительный_ADJ', 'образование_NOUN', 'общий_ADJ', 'численность_NOUN', 'ребенок_NOUN', 'возраст_NOUN', 'год_NOUN']",46
15789,ДОЛЯ ДЕТЕЙ И ПОДРОСТКОВ В ВОЗРАСТЕ ЛЕТ ПРИНИМАЮЩИХ АКТИВНОЕ УЧАСТИЕ В МЕРОПРИЯТИЯХ РАЗЛИЧНОГО УРОВНЯ В ОБЩЕЙ ЧИСЛЕННОСТИ ОБУЧАЮЩИХСЯ И ВОСПИТАННИКОВ СИСТЕМЫ ДОПОЛНИТЕЛЬНОГО ОБРАЗОВАНИЯ,"['доля_NOUN', 'ребенок_NOUN', 'подросток_NOUN', 'возраст_NOUN', 'год_NOUN', 'принимать_VERB', 'активность_NOUN', 'участие_NOUN', 'мероприятие_NOUN', 'различный_ADJ', 'уровень_NOUN', 'общий_ADJ', 'численность_NOUN', 'обучающийся_NOUN', 'воспитанник_NOUN', 'система_NOUN', 'дополнительный_ADJ', 'образование_NOUN']",-1
15794,СООТНОШЕНИЕ СРЕДНЕМЕСЯЧНОЙ ЗАРАБОТНОЙ ПЛАТЫ ПЕДАГОГОВ МУНИЦИПАЛЬНЫХ УЧРЕЖДЕНИЙ ДОПОЛНИТЕЛЬНОГО ОБРАЗОВАНИЯ ЗА ТЕКУЩИЙ ГОД К ПРЕДЫДУЩЕМУ,"['соотношение_NOUN', 'среднемесячный_ADJ', 'заработный_ADJ', 'плата_NOUN', 'педагог_NOUN', 'муниципальный_ADJ', 'учреждение_NOUN', 'дополнительный_ADJ', 'образование_NOUN', 'текущий_ADJ', 'год_NOUN', 'предыдущий_ADJ']",-1
15804,ДОЛЯ ДЕТЕЙ ОХВАЧЕННЫХ ОБРАЗОВАТЕЛЬНЫМИ ПРОГРАММАМИ ДОПОЛНИТЕЛЬНОГО ОБРАЗОВАНИЯ ДЕТЕЙ И МОЛОДЕЖИ В ВОЗРАСТЕ ОТ ДО ЛЕТ,"['доля_NOUN', 'ребенок_NOUN', 'охватывать_VERB', 'образование_NOUN', 'программа_NOUN', 'дополнительный_ADJ', 'образование_NOUN', 'ребенок_NOUN', 'молодежь_NOUN', 'возраст_NOUN', 'год_NOUN']",43
15817,ДОЛЯ ДЕТЕЙ ОТ ДО ОХВАЧЕННЫХ ДОПОЛНИТЕЛЬНЫМ ОБРАЗОВАНИЕМ ТЕХНИЧЕСКОЙ НАПРАВЛЕННОСТИ,"['доля_NOUN', 'ребенок_NOUN', 'охватывать_VERB', 'дополнительный_ADJ', 'образование_NOUN', 'технический_ADJ', 'направленность_NOUN']",28
15818,ОТНОШЕНИЕ СРЕДНЕМЕСЯЧНОЙ ЗАРАБОТНОЙ ПЛАТЫ ПЕДАГОГИЧЕСКИХ РАБОТНИКОВ МУНИЦИПАЛЬНЫХ ОРГАНИЗАЦИЙ ДОПОЛНИТЕЛЬНОГО ОБРАЗОВАНИЯ ДЕТЕЙ К СРЕДНЕМЕСЯЧНОЙ ЗАРАБОТНОЙ ПЛАТЕ УЧИТЕЛЕЙ В МОСКОВСКОЙ ОБЛАСТИ,"['отношение_NOUN', 'среднемесячный_ADJ', 'заработный_ADJ', 'плата_NOUN', 'педагогический_ADJ', 'работник_NOUN', 'муниципальный_ADJ', 'организация_NOUN', 'дополнительный_ADJ', 'образование_NOUN', 'ребенок_NOUN', 'среднемесячный_ADJ', 'заработный_ADJ', 'плата_NOUN', 'учитель_NOUN', 'область_NOUN']",37
15831,ОБЕСПЕЧЕНИЕ РАЗВИТИЯ СЕТЕВОГО ВЗАИМОДЕЙСТВИЯ УЧРЕЖДЕНИЙ ОБЩЕГО И ДОПОЛНИТЕЛЬНОГО ОБРАЗОВАНИЯ,"['обеспечение_NOUN', 'развитие_NOUN', 'сетевой_ADJ', 'взаимодействие_NOUN', 'учреждение_NOUN', 'общий_ADJ', 'дополнительный_ADJ', 'образование_NOUN']",-1
15837,ЧИСЛО ОРГАНИЗАЦИЙ ДОПОЛНИТЕЛЬНОГО ОБРАЗОВАНИЯ ДЕТЕЙ,"['число_NOUN', 'организация_NOUN', 'дополнительный_ADJ', 'образование_NOUN', 'ребенок_NOUN']",34
15844,ПРОЦЕНТ ДЕТЕЙ ОБУЧАЮЩИХСЯ В ДЕТСКОЙ ШКОЛЕ ИСКУССТВ ОТ ОБЩЕГО ЧИСЛА ДЕТЕЙ;,"['процент_NOUN', 'ребенок_NOUN', 'обучающийся_NOUN', 'детский_ADJ', 'школа_NOUN', 'искусство_NOUN', 'общий_ADJ', 'число_NOUN', 'ребенок_NOUN']",19
15845,ОХВАТ ДЕТЕЙ В ВОЗРАСТЕ ЛЕТ ПРОГРАММАМИ ДОПОЛНИТЕЛЬНОГО ОБРАЗОВАНИЯ УДЕЛЬНЫЙ ВЕС ЧИСЛЕННОСТИ ДЕТЕЙ ПОЛУЧАЮЩИХ УСЛУГИ ДОПОЛНИТЕЛЬНОГО ОБРАЗОВАНИЯ В ОБЩЕЙ ЧИСЛЕННОСТИ ДЕТЕЙ В ВОЗРАСТЕ ЛЕТ,"['охват_NOUN', 'ребенок_NOUN', 'возраст_NOUN', 'год_NOUN', 'программа_NOUN', 'дополнительный_ADJ', 'образование_NOUN', 'удельный_ADJ', 'вес_NOUN', 'численность_NOUN', 'ребенок_NOUN', 'получение_NOUN', 'услуга_NOUN', 'дополнительный_ADJ', 'образование_NOUN', 'общий_ADJ', 'численность_NOUN', 'ребенок_NOUN', 'возраст_NOUN', 'год_NOUN']",41
15851,ОХВАТ ДЕТЕЙ В ВОЗРАСТЕ ЛЕТ ПРОГРАММАМИ ДОПОЛНИТЕЛЬНОГО ОБРАЗОВАНИЯ УДЕЛЬНЫЙ ВЕС ЧИСЛЕННОСТИ ДЕТЕЙ ПОЛУЧАЮЩИХ УСЛУГИ ДОПОЛНИТЕЛЬНОГО ОБРАЗОВАНИЯ В ОБЩЕЙ ЧИСЛЕННОСТИ ДЕТЕЙ В ВОЗРАСТЕ ЛЕТ,"['охват_NOUN', 'ребенок_NOUN', 'возраст_NOUN', 'год_NOUN', 'программа_NOUN', 'дополнительный_ADJ', 'образование_NOUN', 'удельный_ADJ', 'вес_NOUN', 'численность_NOUN', 'ребенок_NOUN', 'получение_NOUN', 'услуга_NOUN', 'дополнительный_ADJ', 'образование_NOUN', 'общий_ADJ', 'численность_NOUN', 'ребенок_NOUN', 'возраст_NOUN', 'год_NOUN']",41
15859,ДОЛЯ ДЕТЕЙ ОХВАЧЕННЫХ ДОПОЛНИТЕЛЬНЫМИ ОБРАЗОВАТЕЛЬНЫМИ ПРОГРАММАМИ В ОБЩЕЙ ЧИСЛЕННОСТИ ДЕТЕЙ И МОЛОДЕЖИ ОТ ДО ЛЕТ,"['доля_NOUN', 'ребенок_NOUN', 'охватывать_VERB', 'дополнительный_ADJ', 'образование_NOUN', 'программа_NOUN', 'общий_ADJ', 'численность_NOUN', 'ребенок_NOUN', 'молодежь_NOUN', 'год_NOUN']",43
15871,ОТНОШЕНИЕ СРЕДНЕМЕСЯЧНОЙ ЗАРАБОТНОЙ ПЛАТЫ ПЕДАГОГИЧЕСКИХ РАБОТНИКОВ МУНИЦИПАЛЬНЫХ ОРГАНИЗАЦИЙ ДОПОЛНИТЕЛЬНОГО ОБРАЗОВАНИЯ ДЕТЕЙ К СРЕДНЕМЕСЯЧНОЙ ЗАРАБОТНОЙ ПЛАТЕ УЧИТЕЛЕЙ КУРСКОЙ ОБЛАСТИ,"['отношение_NOUN', 'среднемесячный_ADJ', 'заработный_ADJ', 'плата_NOUN', 'педагогический_ADJ', 'работник_NOUN', 'муниципальный_ADJ', 'организация_NOUN', 'дополнительный_ADJ', 'образование_NOUN', 'ребенок_NOUN', 'среднемесячный_ADJ', 'заработный_ADJ', 'плата_NOUN', 'учитель_NOUN', 'область_NOUN']",37
15891,ДОЛЯ ПРИЗЕРОВ И ПОБЕДИТЕЛЕЙ КОНКУРСОВ РАЗЛИЧНОГО УРОВНЯ ОТ ОБЩЕГО КОЛИЧЕСТВА ВОСПИТАННИКОВ УЧРЕЖДЕНИЯ ДОПОЛНИТЕЛЬНОГО ОБРАЗОВАНИЯ,"['доля_NOUN', 'призер_NOUN', 'победитель_NOUN', 'конкурс_NOUN', 'различный_ADJ', 'уровень_NOUN', 'общий_ADJ', 'количество_NOUN', 'воспитанник_NOUN', 'учреждение_NOUN', 'дополнительный_ADJ', 'образование_NOUN']",-1
15896,ЧИСЛЕННОСТЬ ОБУЧАЮЩИХСЯ КОТОРЫМ ПРЕДОСТАВЛЕНЫ УСЛУГИ ПО РЕАЛИЗАЦИИ ПРОГРАММ ДОПОЛНИТЕЛЬНОГО ОБРАЗОВАНИЯ В МУНИЦИПАЛЬНЫХ ОРГАНИЗАЦИЯХ ДОПОЛНИТЕЛЬНОГО ОБРАЗОВАНИЯ ДЕТЕЙ,"['численность_NOUN', 'обучающийся_NOUN', 'который_DET', 'предоставление_NOUN', 'услуга_NOUN', 'реализация_NOUN', 'программа_NOUN', 'дополнительный_ADJ', 'образование_NOUN', 'муниципальный_ADJ', 'организация_NOUN', 'дополнительный_ADJ', 'образование_NOUN', 'ребенок_NOUN']",-1
15911,ДОЛЯ ДЕТЕЙ В ВОЗРАСТЕ ЛЕТ ОХВАЧЕННЫХ ПРОГРАММАМИ ДОПОЛНИТЕЛЬНОГО ОБРАЗОВАНИЯ ПОЛУЧАЮЩИХ УСЛУГИ ДОПОЛНИТЕЛЬНОГО ОБРАЗОВАНИЯ В ОБЩЕЙ ЧИСЛЕННОСТИ ДЕТЕЙ В ВОЗРАСТЕ ЛЕТ,"['доля_NOUN', 'ребенок_NOUN', 'возраст_NOUN', 'год_NOUN', 'охватывать_VERB', 'программа_NOUN', 'дополнительный_ADJ', 'образование_NOUN', 'получение_NOUN', 'услуга_NOUN', 'дополнительный_ADJ', 'образование_NOUN', 'общий_ADJ', 'численность_NOUN', 'ребенок_NOUN', 'возраст_NOUN', 'год_NOUN']",49
15943,УВЕЛИЧЕНИЕ ЧИСЛА УЧАЩИХСЯ В УЧРЕЖДЕНИЯХ ДОПОЛНИТЕЛЬНОГО ОБРАЗОВАНИЯ ДЕТЕЙ,"['увеличение_NOUN', 'число_NOUN', 'учащийся_NOUN', 'учреждение_NOUN', 'дополнительный_ADJ', 'образование_NOUN', 'ребенок_NOUN']",23
15950,ДОЛЯ ОРГАНИЗАЦИЙ ДОПОЛНИТЕЛЬНОГО ОБРАЗОВАНИЯ ВНЕДРЯЮЩИХ ЭФФЕКТИВНЫЙ КОНТРАКТ С РУКОВОДИТЕЛЕМ,"['доля_NOUN', 'организация_NOUN', 'дополнительный_ADJ', 'образование_NOUN', 'внедрение_NOUN', 'эффект_NOUN', 'контракт_NOUN', 'руководитель_NOUN']",4
15967,ДОЛЯ РУКОВОДИТЕЛЕЙ МУНИЦИПАЛЬНЫХ ОРГАНИЗАЦИЙ ДОПОЛНИТЕЛЬНОГО ОБРАЗОВАНИЯ ДЕТЕЙ ПРОШЕДШИХ В ТЕЧЕНИЕ ПОСЛЕДНИХ ТРЕХ ЛЕТ ПОВЫШЕНИЕ КВАЛИФИКАЦИИ ИЛИ ПРОФЕССИОНАЛЬНУЮ ПЕРЕПОДГОТОВКУ В ОБЩЕЙ ЧИСЛЕННОСТИ РУКОВОДИТЕЛЕЙ ОРГАНИЗАЦИЙ ДОПОЛНИТЕЛЬНОГО ОБРАЗОВАНИЯ ДЕТЕЙ,"['доля_NOUN', 'руководитель_NOUN', 'муниципальный_ADJ', 'организация_NOUN', 'дополнительный_ADJ', 'образование_NOUN', 'ребенок_NOUN', 'проходить_VERB', 'течение_NOUN', 'последний_ADJ', 'год_NOUN', 'повышение_NOUN', 'квалификация_NOUN', 'профессиональный_ADJ', 'переподготовка_NOUN', 'общий_ADJ', 'численность_NOUN', 'руководитель_NOUN', 'организация_NOUN', 'дополнительный_ADJ', 'образование_NOUN', 'ребенок_NOUN']",16
16000,ДОЛЯ ПЕДАГОГИЧЕСКИХ РАБОТНИКОВ МУНИЦИПАЛЬНЫХ ОБРАЗОВАТЕЛЬНЫХ ОРГАНИЗАЦИЙ ДОПОЛНИТЕЛЬНОГО ОБРАЗОВАНИЯ ДЕТЕЙ С КОТОРЫМИ ЗАКЛЮЧЕНЫ ЭФФЕКТИВНЫЕ КОНТРАКТЫ,"['доля_NOUN', 'педагогический_ADJ', 'работник_NOUN', 'муниципальный_ADJ', 'образование_NOUN', 'организация_NOUN', 'дополнительный_ADJ', 'образование_NOUN', 'ребенок_NOUN', 'который_DET', 'заключенная_NOUN', 'эффект_NOUN', 'контракт_NOUN']",-1
16044,ТЕМП РОСТА СРЕДНЕМЕСЯЧНОЙ НОМИНАЛЬНОЙ НАЧИСЛЕННОЙ ЗАРАБОТНОЙ ПЛАТЫ ПЕДАГОГИЧЕСКИХ РАБОТНИКОВ ОРГАНИЗАЦИЙ ДОПОЛНИТЕЛЬНОГО ОБРАЗОВАНИЯ ДЕТЕЙ,"['темп_NOUN', 'рост_NOUN', 'среднемесячный_ADJ', 'номинальный_ADJ', 'начисление_NOUN', 'заработный_ADJ', 'плата_NOUN', 'педагогический_ADJ', 'работник_NOUN', 'организация_NOUN', 'дополнительный_ADJ', 'образование_NOUN', 'ребенок_NOUN']",5
16051,ОТНОШЕНИЕ СРЕДНЕМЕСЯЧНОЙ ЗАРАБОТНОЙ ПЛАТЫ ПЕДАГОГИЧЕСКИХ РАБОТНИКОВ ОБРАЗОВАТЕЛЬНЫХ ОРГАНИЗАЦИЙ ДОПОЛНИТЕЛЬНОГО ОБРАЗОВАНИЯ ДЕТЕЙ ПОДВЕДОМСТВЕННЫХ МИНИСТЕРСТВУ ОБРАЗОВАНИЯ МОСКОВСКОЙ ОБЛАСТИ К СРЕДНЕМЕСЯЧНОЙ ЗАРАБОТНОЙ ПЛАТЕ УЧИТЕЛЕЙ В МОСКОВСКОЙ ОБЛАСТИ,"['отношение_NOUN', 'среднемесячный_ADJ', 'заработный_ADJ', 'плата_NOUN', 'педагогический_ADJ', 'работник_NOUN', 'образование_NOUN', 'организация_NOUN', 'дополнительный_ADJ', 'образование_NOUN', 'ребенок_NOUN', 'подведомственный_ADJ', 'министерство_NOUN', 'образование_NOUN', 'область_NOUN', 'среднемесячный_ADJ', 'заработный_ADJ', 'плата_NOUN', 'учитель_NOUN', 'область_NOUN']",-1
16052,ФОНД ЗАРАБОТНОЙ ПЛАТЫ ПЕДАГОГИЧЕСКИХ РАБОТНИКОВ ОРГАНИЗАЦИЙ ДОПОЛНИТЕЛЬНОГО ОБРАЗОВАНИЯ ДЕТЕЙ В УЧРЕЖДЕНИЯХ КУЛЬТУРЫ,"['фонд_NOUN', 'заработный_ADJ', 'плата_NOUN', 'педагогический_ADJ', 'работник_NOUN', 'организация_NOUN', 'дополнительный_ADJ', 'образование_NOUN', 'ребенок_NOUN', 'учреждение_NOUN', 'культура_NOUN']",12
16082,УДЕЛЬНЫЙ ВЕС ДЕТЕЙ В ВОЗРАСТЕ ОТ ДО ЛЕТ ОХВАЧЕННЫХ ПРОГРАММАМИ ДОПОЛНИТЕЛЬНОГО ОБРАЗОВАНИЯ В ОБЩЕЙ ЧИСЛЕННОСТИ ДЕТЕЙ В ВОЗРАСТЕ ОТ ДО ЛЕТ,"['удельный_ADJ', 'вес_NOUN', 'ребенок_NOUN', 'возраст_NOUN', 'год_NOUN', 'охватывать_VERB', 'программа_NOUN', 'дополнительный_ADJ', 'образование_NOUN', 'общий_ADJ', 'численность_NOUN', 'ребенок_NOUN', 'возраст_NOUN', 'год_NOUN']",47
16084,СООТНОШЕНИЕ СРЕДНЕМЕСЯЧНОЙ ЗАРАБОТНОЙ ПЛАТЫ ПЕДАГОГИЧЕСКИХ РАБОТНИКОВ МУНИЦИПАЛЬНЫХ УЧРЕЖДЕНИЙ ДОПОЛНИТЕЛЬНОГО ОБРАЗОВАНИЯ ДЕТЕЙ К СРЕДНЕМЕСЯЧНОЙ ЗАРАБОТНОЙ ПЛАТЕ УЧИТЕЛЕЙ В СВЕРДЛОВСКОЙ ОБЛАСТИ,"['соотношение_NOUN', 'среднемесячный_ADJ', 'заработный_ADJ', 'плата_NOUN', 'педагогический_ADJ', 'работник_NOUN', 'муниципальный_ADJ', 'учреждение_NOUN', 'дополнительный_ADJ', 'образование_NOUN', 'ребенок_NOUN', 'среднемесячный_ADJ', 'заработный_ADJ', 'плата_NOUN', 'учитель_NOUN', 'область_NOUN']",21
16087,ДОЛЯ ОБУЧАЮЩИХСЯ ЯВЛЯЮЩИХСЯ УЧАСТНИКАМИ МЕРОПРИЯТИЙ ПРОФОРИЕНТАЦИОННОЙ НАПРАВЛЕННОСТИ В ТОМ ЧИСЛЕ В РАМКАХ РЕАЛИЗАЦИИ КОМПЛЕКСНОЙ ПРОГРАММЫ УРАЛЬСКАЯ ИНЖЕНЕРНАЯ ШКОЛА В ОБЩЕЙ ЧИСЛЕННОСТИ ОБУЧАЮЩИХСЯ УЧРЕЖДЕНИЙ ОБЩЕГО И ДОПОЛНИТЕЛЬНОГО ОБРАЗОВАНИЯ,"['доля_NOUN', 'обучающийся_NOUN', 'являться_VERB', 'участник_NOUN', 'мероприятие_NOUN', 'профориентация_NOUN', 'направленность_NOUN', 'число_NOUN', 'рамка_NOUN', 'реализация_NOUN', 'комплекс_NOUN', 'программа_NOUN', 'уральский_ADJ', 'инженерный_ADJ', 'школа_NOUN', 'общий_ADJ', 'численность_NOUN', 'обучающийся_NOUN', 'учреждение_NOUN', 'общий_ADJ', 'дополнительный_ADJ', 'образование_NOUN']",-1
