0,1,2,3
23428,ОХВАТ ДЕТЕЙ В ВОЗРАСТЕ ЛЕТ ПРОГРАММАМИ ДОПОЛНИТЕЛЬНОГО ОБРАЗОВАНИЯ,"['охват_NOUN', 'ребенок_NOUN', 'возраст_NOUN', 'год_NOUN', 'программа_NOUN', 'дополнительный_ADJ', 'образование_NOUN']",42
23480,ДОЛЯ ДЕТЕЙ В ВОЗРАСТЕ ОТ ЛЕТ ПОЛУЧАЮЩИХ УСЛУГИ ПО ДОПОЛНИТЕЛЬНОМУ ОБРАЗОВАНИЮ К ОБЩЕЙ ЧИСЛЕННОСТИ ДЕТЕЙ ДАННОЙ ВОЗРАСТНОЙ ГРУППЫ,"['доля_NOUN', 'ребенок_NOUN', 'возраст_NOUN', 'год_NOUN', 'получение_NOUN', 'услуга_NOUN', 'дополнительный_ADJ', 'образование_NOUN', 'общий_ADJ', 'численность_NOUN', 'ребенок_NOUN', 'данный_ADJ', 'возраст_NOUN', 'группа_NOUN']",27
23506,ДОЛЯ РУКОВОДИТЕЛЕЙ И ПЕДАГОГОВ ДОПОЛНИТЕЛЬНОГО ОБРАЗОВАНИЯ ПРОШЕДШИХ АТТЕСТАЦИЮ И ПОВЫСИВШИХ СВОЮ КВАЛИФИКАЦИОННУЮ КАТЕГОРИЮ В ОТЧЕТНОМ ПЕРИОДЕ,"['доля_NOUN', 'руководитель_NOUN', 'педагог_NOUN', 'дополнительный_ADJ', 'образование_NOUN', 'прошедший_ADJ', 'аттестация_NOUN', 'повышать_VERB', 'свой_DET', 'квалификация_NOUN', 'категория_NOUN', 'отчет_NOUN', 'период_NOUN']",-1
23564,ДОЛЯ ДЕТЕЙ И ПОДРОСТКОВ В ВОЗРАСТЕ ЛЕТ ПРОЖИВАЮЩИХ НА ТЕРРИТОРИИ РАЙОНА ЗАНИМАЮЩИХСЯ В СИСТЕМЕ ДОПОЛНИТЕЛЬНОГО ОБРАЗОВАНИЯ ДЕТЕЙ В ОБЩЕЙ ЧИСЛЕННОСТИ ДЕТЕЙ И ПОДРОСТКОВ В ВОЗРАСТЕ ЛЕТ ПРОЖИВАЮЩИХ НА ТЕРРИТОРИИ РАЙОНА,"['доля_NOUN', 'ребенок_NOUN', 'подросток_NOUN', 'возраст_NOUN', 'год_NOUN', 'проживание_NOUN', 'территория_NOUN', 'район_NOUN', 'заниматься_VERB', 'система_NOUN', 'дополнительный_ADJ', 'образование_NOUN', 'ребенок_NOUN', 'общий_ADJ', 'численность_NOUN', 'ребенок_NOUN', 'подросток_NOUN', 'возраст_NOUN', 'год_NOUN', 'проживание_NOUN', 'территория_NOUN', 'район_NOUN']",3
23587,РОСТ ОХВАТА МАЛОМОБИЛЬНЫХ ГРУПП ОБУЧАЮЩИХСЯ И ВОСПИТАННИКОВ ДОПОЛНИТЕЛЬНЫМ ОБРАЗОВАНИЕМ,"['рост_NOUN', 'охват_NOUN', 'маломобильный_ADJ', 'группа_NOUN', 'обучающийся_NOUN', 'воспитанник_NOUN', 'дополнительный_ADJ', 'образование_NOUN']",-1
23604,ОТНОШЕНИЕ СРЕДНЕЙ ЗАРАБОТНОЙ ПЛАТЫ ПЕДАГОГИЧЕСКИХ РАБОТНИКОВ ОРГАНИЗАЦИЙ ДОПОЛНИТЕЛЬНОГО ОБРАЗОВАНИЯ К СРЕДНЕЙ ЗАРАБОТНОЙ ПЛАТЕ УЧИТЕЛЕЙ В МУНИЦИПАЛЬНОМ ОБРАЗОВАНИИ ГОРОД МУРМАНСК,"['отношение_NOUN', 'среднее_NOUN', 'заработный_ADJ', 'плата_NOUN', 'педагогический_ADJ', 'работник_NOUN', 'организация_NOUN', 'дополнительный_ADJ', 'образование_NOUN', 'среднее_NOUN', 'заработный_ADJ', 'плата_NOUN', 'учитель_NOUN', 'муниципальный_ADJ', 'образование_NOUN', 'город_NOUN']",-1
23656,ДОЛЯ ДЕТЕЙ ОТ ДО ЛЕТ ОХВАЧЕННЫХ ДОПОЛНИТЕЛЬНЫМ ОБРАЗОВАНИЕМ ТЕХНИЧЕСКОЙ НАПРАВЛЕННОСТИ ПРОЦЕНТ,"['доля_NOUN', 'ребенок_NOUN', 'год_NOUN', 'охватывать_VERB', 'дополнительный_ADJ', 'образование_NOUN', 'технический_ADJ', 'направленность_NOUN', 'процент_NOUN']",19
23659,ДОЛЯ ДЕТЕЙ ОХВАЧЕННЫХ ОБРАЗОВАТЕЛЬНЫМИ ПРОГРАММАМИ ДОПОЛНИТЕЛЬНОГО ОБРАЗОВАНИЯ В ОБЩЕЙ ЧИСЛЕННОСТИ ДЕТЕЙ И МОЛОДЕЖИ ЛЕТ,"['доля_NOUN', 'ребенок_NOUN', 'охватывать_VERB', 'образование_NOUN', 'программа_NOUN', 'дополнительный_ADJ', 'образование_NOUN', 'общий_ADJ', 'численность_NOUN', 'ребенок_NOUN', 'молодежь_NOUN', 'год_NOUN']",43
23677,УДЕЛЬНЫЙ ВЕС ДЕТЕЙ В ВОЗРАСТЕ ОТ ДО ЛЕТ ОХВАЧЕННЫХ ПРОГРАММАМИ ДОПОЛНИТЕЛЬНОГО ОБРАЗОВАНИЯ ОТ ОБЩЕГО ЧИСЛА ДЕТЕЙ В ВОЗРАСТЕ ОТ ДО ЛЕТ,"['удельный_ADJ', 'вес_NOUN', 'ребенок_NOUN', 'возраст_NOUN', 'год_NOUN', 'охватывать_VERB', 'программа_NOUN', 'дополнительный_ADJ', 'образование_NOUN', 'общий_ADJ', 'число_NOUN', 'ребенок_NOUN', 'возраст_NOUN', 'год_NOUN']",34
23695,ДОЛЯ МУНИЦИПАЛЬНЫХ УЧРЕЖДЕНИЙ ДОПОЛНИТЕЛЬНОГО ОБРАЗОВАНИЯ ДЕТЕЙ ЗДАНИЯ КОТОРЫХ НАХОДЯТСЯ В АВАРИЙНОМ СОСТОЯНИИ ИЛИ ТРЕБУЮТ КАПИТАЛЬНОГО РЕМОНТА В ОБЩЕМ КОЛИЧЕСТВЕ МУНИЦИПАЛЬНЫХ УЧРЕЖДЕНИЙ ДОПОЛНИТЕЛЬНОГО ОБРАЗОВАНИЯ ДЕТЕЙ,"['доля_NOUN', 'муниципальный_ADJ', 'учреждение_NOUN', 'дополнительный_ADJ', 'образование_NOUN', 'ребенок_NOUN', 'здание_NOUN', 'который_DET', 'находиться_VERB', 'аварийный_ADJ', 'состояние_NOUN', 'требовать_VERB', 'капитальный_ADJ', 'ремонт_NOUN', 'общий_ADJ', 'количество_NOUN', 'муниципальный_ADJ', 'учреждение_NOUN', 'дополнительный_ADJ', 'образование_NOUN', 'ребенок_NOUN']",-1
23700,ДОЛЯ ДЕТЕЙ ОХВАЧЕННЫХ ОБРАЗОВАТЕЛЬНЫМИ ПРОГРАММАМИ ДОПОЛНИТЕЛЬНОГО ОБРАЗОВАНИЯ ДЕТЕЙ В ОБЩЕЙ ЧИСЛЕННОСТИ ДЕТЕЙ И МОЛОДЕЖИ ЛЕТ,"['доля_NOUN', 'ребенок_NOUN', 'охватывать_VERB', 'образование_NOUN', 'программа_NOUN', 'дополнительный_ADJ', 'образование_NOUN', 'ребенок_NOUN', 'общий_ADJ', 'численность_NOUN', 'ребенок_NOUN', 'молодежь_NOUN', 'год_NOUN']",43
23710,ПЕДАГОГИЧЕСКИХ РАБОТНИКОВ ОРГАНИЗАЦИЙ ДОПОЛНИТЕЛЬНОГО ОБРАЗОВАНИЯ ДЕТЕЙ,"['педагогический_ADJ', 'работник_NOUN', 'организация_NOUN', 'дополнительный_ADJ', 'образование_NOUN', 'ребенок_NOUN']",44
23732,ОТНОШЕНИЕ СРЕДНЕМЕСЯЧНОЙ ЗАРАБОТНОЙ ПЛАТЫ ПЕДАГОГИЧЕСКИХ РАБОТНИКОВ ОРГАНИЗАЦИЙ ДОПОЛНИТЕЛЬНОГО ОБРАЗОВАНИЯ ДЕТЕЙ К СРЕДНЕМЕСЯЧНОЙ ЗАРАБОТНОЙ ПЛАТЕ УЧИТЕЛЕЙ В МОСКОВСКОЙ ОБЛАСТИ,"['отношение_NOUN', 'среднемесячный_ADJ', 'заработный_ADJ', 'плата_NOUN', 'педагогический_ADJ', 'работник_NOUN', 'организация_NOUN', 'дополнительный_ADJ', 'образование_NOUN', 'ребенок_NOUN', 'среднемесячный_ADJ', 'заработный_ADJ', 'плата_NOUN', 'учитель_NOUN', 'область_NOUN']",37
23733,ОТНОШЕНИЕ СРЕДНЕМЕСЯЧНОЙ ЗАРАБОТНОЙ ПЛАТЫ ПЕДАГОГИЧЕСКИХ РАБОТНИКОВ ОРГАНИЗАЦИЙ ДОПОЛНИТЕЛЬНОГО ОБРАЗОВАНИЯ ДЕТЕЙ К СРЕДНЕМЕСЯЧНОЙ ЗАРАБОТНОЙ ПЛАТЕ УЧИТЕЛЕЙ В МОСКОВСКОЙ ОБЛАСТИ,"['отношение_NOUN', 'среднемесячный_ADJ', 'заработный_ADJ', 'плата_NOUN', 'педагогический_ADJ', 'работник_NOUN', 'организация_NOUN', 'дополнительный_ADJ', 'образование_NOUN', 'ребенок_NOUN', 'среднемесячный_ADJ', 'заработный_ADJ', 'плата_NOUN', 'учитель_NOUN', 'область_NOUN']",37
23740,ОТНОШЕНИЕ СРЕДНЕМЕСЯЧНОЙ ЗАРАБОТНОЙ ПЛАТЫ ПЕДАГОГИЧЕСКИХ РАБОТНИКОВ ОБРАЗОВАТЕЛЬНЫХ ОРГАНИЗАЦИЙ ДОПОЛНИТЕЛЬНОГО ОБРАЗОВАНИЯ ДЕТЕЙ ПОДВЕДОМСТВЕННЫХ МИНИСТЕРСТВУ ОБРАЗОВАНИЯ МОСКОВСКОЙ ОБЛАСТИ К СРЕДНЕМЕСЯЧНОЙ ЗАРАБОТНОЙ ПЛАТЕ УЧИТЕЛЕЙ В МОСКОВСКОЙ ОБЛАСТИ,"['отношение_NOUN', 'среднемесячный_ADJ', 'заработный_ADJ', 'плата_NOUN', 'педагогический_ADJ', 'работник_NOUN', 'образование_NOUN', 'организация_NOUN', 'дополнительный_ADJ', 'образование_NOUN', 'ребенок_NOUN', 'подведомственный_ADJ', 'министерство_NOUN', 'образование_NOUN', 'область_NOUN', 'среднемесячный_ADJ', 'заработный_ADJ', 'плата_NOUN', 'учитель_NOUN', 'область_NOUN']",-1
23765,ДОЛЯ ДЕТЕЙ ОХВАЧЕННЫХ ОБРАЗОВАТЕЛЬНЫМИ ПРОГРАММАМИ ДОПОЛНИТЕЛЬНОГО ОБРАЗОВАНИЯ В ОБЩЕЙ ЧИСЛЕННОСТИ ДЕТЕЙ И МОЛОДЕЖИ ЛЕТ,"['доля_NOUN', 'ребенок_NOUN', 'охватывать_VERB', 'образование_NOUN', 'программа_NOUN', 'дополнительный_ADJ', 'образование_NOUN', 'общий_ADJ', 'численность_NOUN', 'ребенок_NOUN', 'молодежь_NOUN', 'год_NOUN']",43
23775,ДОЛЯ ДЕТЕЙ В ВОЗРАСТЕ ЛЕТ ПОЛУЧАЮЩИХ УСЛУГИ ПО ДОПОЛНИТЕЛЬНОМУ ОБРАЗОВАНИЮ В УЧРЕЖДЕНИЯХ ФИЗКУЛЬТУРНО СПОРТИВНОЙ НАПРАВЛЕННОСТИ В ОБЩЕЙ ЧИСЛЕННОСТИ ДЕТЕЙ ДАННОЙ ВОЗРАСТНОЙ ГРУППЫ,"['доля_NOUN', 'ребенок_NOUN', 'возраст_NOUN', 'год_NOUN', 'получение_NOUN', 'услуга_NOUN', 'дополнительный_ADJ', 'образование_NOUN', 'учреждение_NOUN', 'физкультура_NOUN', 'спорт_NOUN', 'направленность_NOUN', 'общий_ADJ', 'численность_NOUN', 'ребенок_NOUN', 'данный_ADJ', 'возраст_NOUN', 'группа_NOUN']",-1
23797,ДОЛЯ ОБУЧАЮЩИХСЯ ПО ПРОГРАММАМ ОБЩЕГО ОБРАЗОВАНИЯ ОХВАЧЕННЫХ ОРГАНИЗОВАННОЙ ВНЕУРОЧНОЙ ЗАНЯТОСТЬЮ И ДОПОЛНИТЕЛЬНЫМ ОБРАЗОВАНИИ,"['доля_NOUN', 'обучающийся_NOUN', 'программа_NOUN', 'общий_ADJ', 'образование_NOUN', 'охватывать_VERB', 'организовывать_VERB', 'внеурочный_ADJ', 'занятость_NOUN', 'дополнительный_ADJ', 'образование_NOUN']",-1
23825,УРОВЕНЬ СРЕДНЕЙ ЗАРАБОТНОЙ ПЛАТЫ ПЕДАГОГИЧЕСКИХ РАБОТНИКОВ ОРГАНИЗАЦИЙ ДОПОЛНИТЕЛЬНОГО ОБРАЗОВАНИЯ,"['уровень_NOUN', 'среднее_NOUN', 'заработный_ADJ', 'плата_NOUN', 'педагогический_ADJ', 'работник_NOUN', 'организация_NOUN', 'дополнительный_ADJ', 'образование_NOUN']",30
23827,ДОЛЯ ДЕТЕЙ В ВОЗРАСТЕ ЛЕТ ПОЛУЧАЮЩИХ УСЛУГИ ПО ДОПОЛНИТЕЛЬНОМУ ОБРАЗОВАНИЮ В МУНИЦИПАЛЬНЫХ ОБРАЗОВАТЕЛЬНЫХ УЧРЕЖДЕНИЯХ ПОДВЕДОМСТВЕННЫХ УПРАВЛЕНИЮ ОБРАЗОВАНИЯ В ОБЩЕЙ ЧИСЛЕННОСТИ ДЕТЕЙ В ВОЗРАСТЕ ЛЕТ,"['доля_NOUN', 'ребенок_NOUN', 'возраст_NOUN', 'год_NOUN', 'получение_NOUN', 'услуга_NOUN', 'дополнительный_ADJ', 'образование_NOUN', 'муниципальный_ADJ', 'образование_NOUN', 'учреждение_NOUN', 'подведомственный_ADJ', 'управление_NOUN', 'образование_NOUN', 'общий_ADJ', 'численность_NOUN', 'ребенок_NOUN', 'возраст_NOUN', 'год_NOUN']",-1
23844,УДЕЛЬНЫЙ ВЕС ЧИСЛЕННОСТИ ДЕТЕЙ ПОЛУЧАЮЩИХ УСЛУГИ ДОПОЛНИТЕЛЬНОГО ОБРАЗОВАНИЯ В ОБЩЕЙ ЧИСЛЕННОСТИ ДЕТЕЙ В ВОЗРАСТЕ ЛЕТ,"['удельный_ADJ', 'вес_NOUN', 'численность_NOUN', 'ребенок_NOUN', 'получение_NOUN', 'услуга_NOUN', 'дополнительный_ADJ', 'образование_NOUN', 'общий_ADJ', 'численность_NOUN', 'ребенок_NOUN', 'возраст_NOUN', 'год_NOUN']",46
23845,ОХВАТ ДЕТЕЙ В ВОЗРАСТЕ ОТ ДО ЛЕТ ПРОГРАММАМИ ДОПОЛНИТЕЛЬНОГО ОБРАЗОВАНИЯ УДЕЛЬНЫЙ ВЕС ЧИСЛЕННОСТИ ДЕТЕЙ ПОЛУЧАЮЩИХ УСЛУГИ ДОПОЛНИТЕЛЬНОГО ОБРАЗОВАНИЯ В ОБЩЕЙ ЧИСЛЕННОСТИ ДЕТЕЙ В ВОЗРАСТЕ ОТ ДО ЛЕТ ОБЩЕЙ ЧИСЛЕННОСТИ ДЕТЕЙ В ВОЗРАСТЕ ОТ ДО ЛЕТ,"['охват_NOUN', 'ребенок_NOUN', 'возраст_NOUN', 'год_NOUN', 'программа_NOUN', 'дополнительный_ADJ', 'образование_NOUN', 'удельный_ADJ', 'вес_NOUN', 'численность_NOUN', 'ребенок_NOUN', 'получение_NOUN', 'услуга_NOUN', 'дополнительный_ADJ', 'образование_NOUN', 'общий_ADJ', 'численность_NOUN', 'ребенок_NOUN', 'возраст_NOUN', 'год_NOUN', 'общий_ADJ', 'численность_NOUN', 'ребенок_NOUN', 'возраст_NOUN', 'год_NOUN']",41
23851,КОЛИЧЕСТВО ДЕЙСТВУЮЩИХ ПАТРИОТИЧЕСКИХ ОБЪЕДИНЕНИЙ КЛУБОВ ЦЕНТРОВ КРУЖКОВ В ТОМ ЧИСЛЕ ДЕТСКИХ И МОЛОДЁЖНЫХ,"['количество_NOUN', 'действо_NOUN', 'патриотический_ADJ', 'объединение_NOUN', 'клуб_NOUN', 'центр_NOUN', 'кружок_NOUN', 'число_NOUN', 'детский_ADJ', 'молодежь_NOUN']",-1
23875,УВЕЛИЧЕНИЕ ДОЛИ ДЕТЕЙ И МОЛОДЕЖИ РЕГУЛЯРНО ЗАНИМАЮЩИХСЯ В СПОРТИВНЫХ СЕКЦИЯХ КЛУБАХ И ИНЫХ ОБЪЕДИНЕНИЯХ СПОРТИВНОЙ НАПРАВЛЕННОСТИ С ДО,"['увеличение_NOUN', 'доля_NOUN', 'ребенок_NOUN', 'молодежь_NOUN', 'регулярно_ADV', 'заниматься_VERB', 'спорт_NOUN', 'секция_NOUN', 'клуб_NOUN', 'иной_DET', 'объединение_NOUN', 'спорт_NOUN', 'направленность_NOUN']",-1
23881,ЧИСЛО УЧАЩИХСЯ В ДОПОЛНИТЕЛЬНОМ ОБРАЗОВАНИИ ДЕТЕЙ,"['число_NOUN', 'учащийся_NOUN', 'дополнительный_ADJ', 'образование_NOUN', 'ребенок_NOUN']",29
23901,ПОДПРОГРАММА РАЗВИТИЕ ДОПОЛНИТЕЛЬНОГО ОБРАЗОВАНИЯ ВЗРОСЛЫХ,"['подпрограмма_NOUN', 'развитие_NOUN', 'дополнительный_ADJ', 'образование_NOUN', 'взрослый_NOUN']",-1
23930,ДОЛЯ ПЕДАГОГИЧЕСКИХ РАБОТНИКОВ УЧРЕЖДЕНИЙ ОБЕСПЕЧИВАЮЩИХ РЕАЛИЗАЦИЮ ОБРАЗОВАТЕЛЬНЫХ ПРОГРАММ ДОПОЛНИТЕЛЬНОГО ОБРАЗОВАНИЯ ДЕТЕЙ,"['доля_NOUN', 'педагогический_ADJ', 'работник_NOUN', 'учреждение_NOUN', 'обеспеченность_NOUN', 'реализация_NOUN', 'образование_NOUN', 'программа_NOUN', 'дополнительный_ADJ', 'образование_NOUN', 'ребенок_NOUN']",-1
23935,ДОЛЯ МУНИЦИПАЛЬНЫХ УЧРЕЖДЕНИЙ ДОПОЛНИТЕЛЬНОГО ОБРАЗОВАНИЯ ДЕТЕЙ ЗДАНИЯ КОТОРЫХ НАХОДЯТСЯ В АВАРИЙНОМ СОСТОЯНИИ ИЛИ ТРЕБУЮТ КАПИТАЛЬНОГО РЕМОНТА В ОБЩЕМ КОЛИЧЕСТВЕ МУНИЦИПАЛЬНЫХ УЧРЕЖДЕНИЙ ДОПОЛНИТЕЛЬНОГО ОБРАЗОВАНИЯ ДЕТЕЙ,"['доля_NOUN', 'муниципальный_ADJ', 'учреждение_NOUN', 'дополнительный_ADJ', 'образование_NOUN', 'ребенок_NOUN', 'здание_NOUN', 'который_DET', 'находиться_VERB', 'аварийный_ADJ', 'состояние_NOUN', 'требовать_VERB', 'капитальный_ADJ', 'ремонт_NOUN', 'общий_ADJ', 'количество_NOUN', 'муниципальный_ADJ', 'учреждение_NOUN', 'дополнительный_ADJ', 'образование_NOUN', 'ребенок_NOUN']",-1
23938,НЕЗАВИСИМАЯ ОЦЕНКА КАЧЕСТВА ДОПОЛНИТЕЛЬНОГО ОБРАЗОВАНИЯ ДЕТЕЙ,"['независимый_ADJ', 'оценка_NOUN', 'качество_NOUN', 'дополнительный_ADJ', 'образование_NOUN', 'ребенок_NOUN']",-1
23957,СООТНОШЕНИЕ СРЕДНЕЙ ЗАРАБОТНОЙ ПЛАТЫ ПЕДАГОГИЧЕСКИХ РАБОТНИКОВ ОРГАНИЗАЦИЙ ДОПОЛНИТЕЛЬНОГО ОБРАЗОВАНИЯ ДЕТЕЙ К СРЕДНЕЙ ЗАРАБОТНОЙ ПЛАТЕ УЧИТЕЛЕЙ В РЕСПУБЛИКЕ БАШКОРТОСТАН,"['соотношение_NOUN', 'среднее_NOUN', 'заработный_ADJ', 'плата_NOUN', 'педагогический_ADJ', 'работник_NOUN', 'организация_NOUN', 'дополнительный_ADJ', 'образование_NOUN', 'ребенок_NOUN', 'среднее_NOUN', 'заработный_ADJ', 'плата_NOUN', 'учитель_NOUN', 'республика_NOUN']",-1
23981,ДОЛЯ ДЕТЕЙ В ВОЗРАСТЕ ОТ ДО ЛЕТ ОБУЧАЮЩИХСЯ ПО ДОПОЛНИТЕЛЬНЫМ ОБРАЗОВАТЕЛЬНЫМ ПРОГРАММАМ В ОБЩЕЙ ЧИСЛЕННОСТИ ДЕТЕЙ ЭТОГО ВОЗРАСТА В СФЕРЕ КУЛЬТУРЫ И СПОРТА,"['доля_NOUN', 'ребенок_NOUN', 'возраст_NOUN', 'год_NOUN', 'обученность_NOUN', 'дополнительный_ADJ', 'образование_NOUN', 'программа_NOUN', 'общий_ADJ', 'численность_NOUN', 'ребенок_NOUN', 'возраст_NOUN', 'сфера_NOUN', 'культура_NOUN', 'спорт_NOUN']",35
23994,ДОЛЯ ОБУЧАЮЩИХСЯ В УЧРЕЖДЕНИЯХ ОБРАЗОВАНИЯ РЕГУЛЯРНО ЗАНИМАЮЩИХСЯ В СЕКЦИЯХ ФИЗИЧЕСКИ ОЗДОРОВИТЕЛЬНОЙ СПОРТИВНОЙ ТЕХНИЧЕСКОЙ ЭСТЕТИЧЕСКОЙ НАПРАВЛЕННОСТИ,"['доля_NOUN', 'обучающийся_NOUN', 'учреждение_NOUN', 'образование_NOUN', 'регулярно_ADV', 'заниматься_VERB', 'секция_NOUN', 'физически_ADV', 'оздоровительный_ADJ', 'спорт_NOUN', 'технический_ADJ', 'эстетический_ADJ', 'направленность_NOUN']",-1
24008,ПРОВЕДЕНИЕ КАПИТАЛЬНОГО РЕМОНТА ЧАСТИЧНО И МЕРОПРИЯТИЙ ПО ОБЕСПЕЧЕНИЮ ЭКСПЛУАТАЦИОННЫХ ТРЕБОВАНИЙ СОГЛАСНО НОРМАМ БЕЗОПАСНОСТИ В МУНИЦИПАЛЬНЫХ ОБРАЗОВАТЕЛЬНЫХ В ВО ТК ДО ШИ ЛИЦЕЙ ИСКУССТВ ДО N ДО ШИ ИМ Г В СВИРИДОВА ДО ГАРМОНИЯ ДО КАМЕРТОН ДО ФОРТЕ ДО ДМШ N ИМ В М СВЕРДЛОВА ДО N ДО ШКОЛА ИСКУССТВ N ДО ШКОЛА ИСКУССТВ ИМ М А БУДУ N ДО ИМ И Е РЕПИНА БУДУ ИМ М ШАГАЛА ДО ИМ М М ПЛИСЕЦКОЙ ДО ДК ДО ИСТОКИ,"['проведение_NOUN', 'капитальный_ADJ', 'ремонт_NOUN', 'частично_ADV', 'мероприятие_NOUN', 'обеспечение_NOUN', 'эксплуатация_NOUN', 'требование_NOUN', 'согласно_ADP', 'норма_NOUN', 'безопасность_NOUN', 'муниципальный_ADJ', 'образование_NOUN', 'тк_NOUN', 'лицей_NOUN', 'искусство_NOUN', 'свиридов_NOUN', 'гармония_NOUN', 'камертон_NOUN', 'форте_NOUN', 'свердлов_NOUN', 'школа_NOUN', 'искусство_NOUN', 'школа_NOUN', 'искусство_NOUN', 'репин_NOUN', 'шагать_VERB', 'плисецкая_NOUN', 'исток_NOUN']",-1
24010,ДОЛЯ УЧАЩИХСЯ ДЕТСКИХ ШКОЛ ИСКУССТВ ПРИВЛЕКАЕМЫХ К УЧАСТИЮ В КОНКУРСНЫХ ТВОРЧЕСКИХ МЕРОПРИЯТИЯХ ОТ ОБЩЕГО ЧИСЛА УЧАЩИХСЯ ДЕТСКИХ ШКОЛ ИСКУССТВ,"['доля_NOUN', 'учащийся_NOUN', 'детский_ADJ', 'школа_NOUN', 'искусство_NOUN', 'привлекать_VERB', 'участие_NOUN', 'конкурс_NOUN', 'творческий_ADJ', 'мероприятие_NOUN', 'общий_ADJ', 'число_NOUN', 'учащийся_NOUN', 'детский_ADJ', 'школа_NOUN', 'искусство_NOUN']",-1
24040,УВЕЛИЧЕНИЕ ОХВАТА ДЕТЕЙ В ВОЗРАСТЕ ЛЕТ ПРОГРАММАМИ ДОПОЛНИТЕЛЬНОГО ОБРАЗОВАНИЯ,"['увеличение_NOUN', 'охват_NOUN', 'ребенок_NOUN', 'возраст_NOUN', 'год_NOUN', 'программа_NOUN', 'дополнительный_ADJ', 'образование_NOUN']",23
24041,ДОЛЯ ДЕТЕЙ В ВОЗРАСТЕ ОТ ДО ЛЕТ ОБУЧАЮЩИХСЯ ПО ДОПОЛНИТЕЛЬНЫМ ОБРАЗОВАТЕЛЬНЫМ ПРОГРАММАМ В ОБЩЕЙ ЧИСЛЕННОСТИ ДЕТЕЙ ЭТОГО ВОЗРАСТА,"['доля_NOUN', 'ребенок_NOUN', 'возраст_NOUN', 'год_NOUN', 'обученность_NOUN', 'дополнительный_ADJ', 'образование_NOUN', 'программа_NOUN', 'общий_ADJ', 'численность_NOUN', 'ребенок_NOUN', 'возраст_NOUN']",40
24047,ОТНОШЕНИЕ СРЕДНЕМЕСЯЧНОЙ ЗАРАБОТНОЙ ПЛАТЫ РАБОТНИКОВ ОРГАНИЗАЦИЙ ДОПОЛНИТЕЛЬНОГО ОБРАЗОВАНИЯ ДЕТЕЙ К СРЕДНЕМЕСЯЧНОЙ ЗАРАБОТНОЙ ПЛАТЕ В РОСТОВСКОЙ ОБЛАСТИ,"['отношение_NOUN', 'среднемесячный_ADJ', 'заработный_ADJ', 'плата_NOUN', 'работник_NOUN', 'организация_NOUN', 'дополнительный_ADJ', 'образование_NOUN', 'ребенок_NOUN', 'среднемесячный_ADJ', 'заработный_ADJ', 'плата_NOUN', 'область_NOUN']",-1
24058,ДОЛЯ УЧРЕЖДЕНИЙ ДОПОЛНИТЕЛЬНОГО ОБРАЗОВАНИЯ ДЕТЕЙ ОСНАЩЕННЫХ СОВРЕМЕННЫМ ЛАБОРАТОРНЫМ И СПОРТИВНЫМ ОБОРУДОВАНИЕМ,"['доля_NOUN', 'учреждение_NOUN', 'дополнительный_ADJ', 'образование_NOUN', 'ребенок_NOUN', 'оснащение_NOUN', 'современный_ADJ', 'лаборатория_NOUN', 'спорт_NOUN', 'оборудование_NOUN']",-1
24059,ДОЛЯ ДЕТЕЙ ОХВАЧЕННЫХ ДОПОЛНИТЕЛЬНЫМИ ОБРАЗОВАТЕЛЬНЫМИ ПРОГРАММАМИ В ОБЩЕЙ ЧИСЛЕННОСТИ ДЕТЕЙ И МОЛОДЕЖИ ОТ ДО ЛЕТ,"['доля_NOUN', 'ребенок_NOUN', 'охватывать_VERB', 'дополнительный_ADJ', 'образование_NOUN', 'программа_NOUN', 'общий_ADJ', 'численность_NOUN', 'ребенок_NOUN', 'молодежь_NOUN', 'год_NOUN']",43
24063,ИНДЕКС ПОДПРОГРАММЫ ДОПОЛНИТЕЛЬНОЕ ОБРАЗОВАНИЕ,"['индекс_NOUN', 'подпрограмма_NOUN', 'дополнительный_ADJ', 'образование_NOUN']",-1
24086,УВЕЛИЧЕНИЕ КОЛИЧЕСТВА ПЕДАГОГОВ СФЕРЫ ДОПОЛНИТЕЛЬНОГО ОБРАЗОВАНИЯ И ВОСПИТАНИЯ ПРИНЯВШИХ УЧАСТИЕ В СЕМИНАРАХ СОВЕЩАНИЯХ НАУЧНО ПРАКТИЧЕСКИХ КОНФЕРЕНЦИЯХ И ИНЫХ МЕРОПРИЯТИЯХ,"['увеличение_NOUN', 'количество_NOUN', 'педагог_NOUN', 'сфера_NOUN', 'дополнительный_ADJ', 'образование_NOUN', 'воспитание_NOUN', 'принимать_VERB', 'участие_NOUN', 'семинар_NOUN', 'совещание_NOUN', 'научно_ADV', 'практический_ADJ', 'конференция_NOUN', 'иной_DET', 'мероприятие_NOUN']",-1
