0,1,2,3
4,ОТНОШЕНИЕ СРЕДНЕМЕСЯЧНОЙ ЗАРАБОТНОЙ ПЛАТЫ ПЕДАГОГИЧЕСКИХ РАБОТНИКОВ МУНИЦИПАЛЬНЫХ ОРГАНИЗАЦИЙ ДОПОЛНИТЕЛЬНОГО ОБРАЗОВАНИЯ К СРЕДНЕМЕСЯЧНОЙ ЗАРАБОТНОЙ ПЛАТЕ УЧИТЕЛЕЙ В НОВОСИБИРСКОЙ ОБЛАСТИ,"['отношение_NOUN', 'среднемесячный_ADJ', 'заработный_ADJ', 'плата_NOUN', 'педагогический_ADJ', 'работник_NOUN', 'муниципальный_ADJ', 'организация_NOUN', 'дополнительный_ADJ', 'образование_NOUN', 'среднемесячный_ADJ', 'заработный_ADJ', 'плата_NOUN', 'учитель_NOUN', 'область_NOUN']",37
13,СОЗДАНИЕ УСЛОВИЙ ДЛЯ БЕСПРЕПЯТСТВЕННОГО ДОСТУПА В ОБРАЗОВАТЕЛЬНОЕ УЧРЕЖДЕНИЕ ДОПОЛНИТЕЛЬНОГО ОБРАЗОВАНИЯ ДЕТЕЙ С ОФЗ ДЕТЕЙ ИНВАЛИДОВ,"['создание_NOUN', 'условие_NOUN', 'беспрепятственный_ADJ', 'доступ_NOUN', 'образование_NOUN', 'учреждение_NOUN', 'дополнительный_ADJ', 'образование_NOUN', 'ребенок_NOUN', 'ребенок_NOUN', 'инвалид_NOUN']",-1
42,ДОЛЯ ДЕТЕЙ ОХВАЧЕННЫХ ДОПОЛНИТЕЛЬНЫМИ ОБРАЗОВАТЕЛЬНЫМИ ПРОГРАММАМИ В ОБЩЕЙ,"['доля_NOUN', 'ребенок_NOUN', 'охватывать_VERB', 'дополнительный_ADJ', 'образование_NOUN', 'программа_NOUN', 'общий_ADJ']",48
58,УВЕЛИЧЕНИЕ КОЛИЧЕСТВА УЧАЩИХСЯ ДЕТСКОЙ ШКОЛЫ ИСКУССТВ ПО ОТНОШЕНИЮ К ГОДУ,"['увеличение_NOUN', 'количество_NOUN', 'учащийся_NOUN', 'детский_ADJ', 'школа_NOUN', 'искусство_NOUN', 'отношение_NOUN', 'год_NOUN']",-1
59,ДОЛЯ ДЕТЕЙ ОХВАЧЕННЫХ ОБРАЗОВАТЕЛЬНЫМИ ПРОГРАММАМИ ДОПОЛНИТЕЛЬНОГО ОБРАЗОВАНИЯ ДЕТЕЙ В ОБЩЕЙ ЧИСЛЕННОСТИ ДЕТЕЙ И МОЛОДЕЖИ ЛЕТ,"['доля_NOUN', 'ребенок_NOUN', 'охватывать_VERB', 'образование_NOUN', 'программа_NOUN', 'дополнительный_ADJ', 'образование_NOUN', 'ребенок_NOUN', 'общий_ADJ', 'численность_NOUN', 'ребенок_NOUN', 'молодежь_NOUN', 'год_NOUN']",43
65,КОЛИЧЕСТВО ПРЕПОДАВАТЕЛЕЙ УЧИТЕЛЕЙ ПЕДАГОГОВ ДОПОЛНИТЕЛЬНОГО ОБРАЗОВАНИЯ КОТОРЫМ ОКАЗАНА ФИНАНСОВАЯ ПОДДЕРЖКА ПО РЕЗУЛЬТАТАМ УЧАСТИЯ УЧЕНИКОВ ВОСПИТАННИКОВ В ОЛИМПИАДАХ НАУЧНО ПРАКТИЧЕСКИХ КОНФЕРЕНЦИЯХ КОНКУРСАХ ФЕСТИВАЛЯХ СМОТРАХ СОРЕВНОВАНИЯХ ТУРНИРАХ И ЧЕМПИОНАТАХ,"['количество_NOUN', 'преподаватель_NOUN', 'учитель_NOUN', 'педагог_NOUN', 'дополнительный_ADJ', 'образование_NOUN', 'который_DET', 'оказывать_VERB', 'финансовый_ADJ', 'поддержка_NOUN', 'результат_NOUN', 'участие_NOUN', 'ученик_NOUN', 'воспитанник_NOUN', 'олимпиада_NOUN', 'научно_ADV', 'практический_ADJ', 'конференция_NOUN', 'конкурс_NOUN', 'фестиваль_NOUN', 'смотр_NOUN', 'соревнование_NOUN', 'турнир_NOUN', 'чемпионат_NOUN']",-1
66,ДОЛЯ ДЕТЕЙ ОХВАЧЕННЫХ ОБРАЗОВАТЕЛЬНЫМИ ПРОГРАММАМИ ДОПОЛНИТЕЛЬНОГО ОБРАЗОВАНИЯ ДЕТЕЙ В ОБЩЕЙ ЧИСЛЕННОСТИ ДЕТЕЙ И МОЛОДЕЖИ ЛЕТ,"['доля_NOUN', 'ребенок_NOUN', 'охватывать_VERB', 'образование_NOUN', 'программа_NOUN', 'дополнительный_ADJ', 'образование_NOUN', 'ребенок_NOUN', 'общий_ADJ', 'численность_NOUN', 'ребенок_NOUN', 'молодежь_NOUN', 'год_NOUN']",43
75,ВВОД В ДЕЙСТВИЕ ДЕТСКОЙ ШКОЛЫ ИСКУССТВ,"['ввод_NOUN', 'действие_NOUN', 'детский_ADJ', 'школа_NOUN', 'искусство_NOUN']",-1
94,ДОЛЯ МОЮ ДОПОЛНИТЕЛЬНОГО ОБРАЗОВАНИЯ ДЕТЕЙ МАТЕРИАЛЬНО ТЕХНИЧЕСКАЯ БАЗА КОТОРЫХ ОБНОВЛЕНА В ОБЩЕМ КОЛИЧЕСТВЕ ТАКИХ ОРГАНИЗАЦИЙ,"['доля_NOUN', 'дополнительный_ADJ', 'образование_NOUN', 'ребенок_NOUN', 'материально_ADV', 'технический_ADJ', 'база_NOUN', 'который_DET', 'обновление_NOUN', 'общий_ADJ', 'количество_NOUN', 'организация_NOUN']",1
114,ОТНОШЕНИЕ СРЕДНЕМЕСЯЧНОЙ ЗАРАБОТНОЙ ПЛАТЫ ПЕДАГОГОВ МУНИЦИПАЛЬНЫХ ОРГАНИЗАЦИЙ ДОПОЛНИТЕЛЬНОГО ОБРАЗОВАНИЯ ДЕТЕЙ К СРЕДНЕМЕСЯЧНОЙ ЗАРАБОТНОЙ ПЛАТЕ В ОБЛАСТИ,"['отношение_NOUN', 'среднемесячный_ADJ', 'заработный_ADJ', 'плата_NOUN', 'педагог_NOUN', 'муниципальный_ADJ', 'организация_NOUN', 'дополнительный_ADJ', 'образование_NOUN', 'ребенок_NOUN', 'среднемесячный_ADJ', 'заработный_ADJ', 'плата_NOUN', 'область_NOUN']",33
119,ДОЛЯ ДЕТЕЙ СТАРШЕГО ШКОЛЬНОГО ВОЗРАСТА ПОЛУЧАЮЩИХ УСЛУГИ ДОПОЛНИТЕЛЬНОГО ОБРАЗОВАНИЯ ДЕТЕЙ В ОБЩЕЙ ЧИСЛЕННОСТИ ДЕТЕЙ СТАРШЕГО ШКОЛЬНОГО ВОЗРАСТА,"['доля_NOUN', 'ребенок_NOUN', 'старший_ADJ', 'школьный_ADJ', 'возраст_NOUN', 'получение_NOUN', 'услуга_NOUN', 'дополнительный_ADJ', 'образование_NOUN', 'ребенок_NOUN', 'общий_ADJ', 'численность_NOUN', 'ребенок_NOUN', 'старший_ADJ', 'школьный_ADJ', 'возраст_NOUN']",-1
125,УДЕЛЬНЫЙ ВЕС ЧИСЛЕННОСТИ НАСЕЛЕНИЯ В ВОЗРАСТЕ ЛЕТ ОХВАЧЕННОГО ДОПОЛНИТЕЛЬНЫМ ОБРАЗОВАНИЕМ В ОБЩЕЙ ЧИСЛЕННОСТИ НАСЕЛЕНИЯ В ВОЗРАСТЕ ЛЕТ,"['удельный_ADJ', 'вес_NOUN', 'численность_NOUN', 'население_NOUN', 'возраст_NOUN', 'год_NOUN', 'охватывать_VERB', 'дополнительный_ADJ', 'образование_NOUN', 'общий_ADJ', 'численность_NOUN', 'население_NOUN', 'возраст_NOUN', 'год_NOUN']",-1
140,КОЛИЧЕСТВО УЧАСТНИКОВ КОНКУРСНЫХ МЕРОПРИЯТИЙ В ОБЩЕМ ЧИСЛЕ ЗАНИМАЮЩИХСЯ В СИСТЕМЕ ДОПОЛНИТЕЛЬНОГО ОБРАЗОВАНИЯ ДЕТЕЙ,"['количество_NOUN', 'участник_NOUN', 'конкурс_NOUN', 'мероприятие_NOUN', 'общий_ADJ', 'число_NOUN', 'заниматься_VERB', 'система_NOUN', 'дополнительный_ADJ', 'образование_NOUN', 'ребенок_NOUN']",-1
155,УВЕЛИЧЕНИЕ ДОЛИ ДЕТЕЙ В ВОЗРАСТЕ ОТ ДО ЛЕТ ОХВАЧЕННЫХ ДОПОЛНИТЕЛЬНЫМ ОБРАЗОВАНИЕМ,"['увеличение_NOUN', 'доля_NOUN', 'ребенок_NOUN', 'возраст_NOUN', 'год_NOUN', 'охватывать_VERB', 'дополнительный_ADJ', 'образование_NOUN']",23
171,УДЕЛЬНЫЙ ВЕС ОБРАЗОВАТЕЛЬНЫХ УЧРЕЖДЕНИЙ ОСНАЩЕННЫХ СПЕЦИАЛЬНЫМ ОБОРУДОВАНИЕМ ДЛЯ ОРГАНИЗАЦИИ ДЕЯТЕЛЬНОСТИ ФОРМИРОВАНИЙ СИСТЕМЫ ДОПОЛНИТЕЛЬНОГО ОБРАЗОВАНИЯ,"['удельный_ADJ', 'вес_NOUN', 'образование_NOUN', 'учреждение_NOUN', 'оснащение_NOUN', 'специальность_NOUN', 'оборудование_NOUN', 'организация_NOUN', 'деятельность_NOUN', 'формирование_NOUN', 'система_NOUN', 'дополнительный_ADJ', 'образование_NOUN']",-1
183,ДОЛЯ ДЕТЕЙ И МОЛОДЕЖИ В ВОЗРАСТЕ ЛЕТ ОХВАЧЕННЫХ ОБРАЗОВАТЕЛЬНЫМИ ПРОГРАММАМИ ДОПОЛНИТЕЛЬНОГО ОБРАЗОВАНИЯ,"['доля_NOUN', 'ребенок_NOUN', 'молодежь_NOUN', 'возраст_NOUN', 'год_NOUN', 'охватывать_VERB', 'образование_NOUN', 'программа_NOUN', 'дополнительный_ADJ', 'образование_NOUN']",43
189,ОХВАТ ДЕТЕЙ СО СПЕЦИАЛЬНЫМИ ПОТРЕБНОСТЯМИ ОБРАЗОВАТЕЛЬНЫМИ УСЛУГАМИ ДОПОЛНИТЕЛЬНОГО ОБРАЗОВАНИЯ,"['охват_NOUN', 'ребенок_NOUN', 'специальность_NOUN', 'потребность_NOUN', 'образование_NOUN', 'услуга_NOUN', 'дополнительный_ADJ', 'образование_NOUN']",-1
190,ДОЛЯ ДЕТЕЙ В ВОЗРАСТЕ ОТ ДО ЛЕТ ОБУЧАЮЩИХСЯ ПО ДОПОЛНИТЕЛЬНЫМ ОБРАЗОВАТЕЛЬНЫМ ПРОГРАММАМ В ОБЩЕЙ ЧИСЛЕННОСТИ ДЕТЕЙ ЭТОГО ВОЗРАСТА,"['доля_NOUN', 'ребенок_NOUN', 'возраст_NOUN', 'год_NOUN', 'обученность_NOUN', 'дополнительный_ADJ', 'образование_NOUN', 'программа_NOUN', 'общий_ADJ', 'численность_NOUN', 'ребенок_NOUN', 'возраст_NOUN']",40
193,ДОЛЯ ДЕТЕЙ ШКОЛЬНОГО ВОЗРАСТА ОХВАЧЕННЫХ ДОПОЛНИТЕЛЬНЫМ ОБРАЗОВАНИЕМ,"['доля_NOUN', 'ребенок_NOUN', 'школьный_ADJ', 'возраст_NOUN', 'охватывать_VERB', 'дополнительный_ADJ', 'образование_NOUN']",22
202,ДОЛЯ ПЕДАГОГИЧЕСКИХ РАБОТНИКОВ ДОПОЛНИТЕЛЬНОГО ОБРАЗОВАНИЯ ДЕТЕЙ КОТОРЫМ ПРИ ПРОХОЖДЕНИИ АТТЕСТАЦИИ ПРИСВОЕНА ПЕРВАЯ ИЛИ ВЫСШАЯ КАТЕГОРИЯ,"['доля_NOUN', 'педагогический_ADJ', 'работник_NOUN', 'дополнительный_ADJ', 'образование_NOUN', 'ребенок_NOUN', 'который_DET', 'прохождение_NOUN', 'аттестация_NOUN', 'присваивать_VERB', 'первый_ADJ', 'высокий_ADJ', 'категория_NOUN']",-1
205,УЧАСТИЯ ОБУЧАЮЩИХСЯ В РАМКАХ СИСТЕМЫ ОБЩЕГО И ДОПОЛНИТЕЛЬНОГО ОБРАЗОВАНИЯ В МУНИЦИПАЛЬНЫХ РЕГИОНАЛЬНЫХ ВСЕРОССИЙСКИХ МЕРОПРИЯТИЯХ ФЕСТИВАЛЯХ КОНКУРСАХ СОРЕВНОВАНИЯХ ОЛИМПИАДАХ МАСТЕР-КЛАССАХ И ДРУГИХ МЕРОПРИЯТИЯХ ДЛЯ ВЫЯВЛЕНИЯ ОДАРЕННЫХ ДЕТЕЙ В РАЗЛИЧНЫХ ОБЛАСТЯХ ИНТЕЛЛЕКТУАЛЬНОЙ И ТВОРЧЕСКОЙ ДЕЯТЕЛЬНОСТИ,"['участие_NOUN', 'обученность_NOUN', 'рамка_NOUN', 'система_NOUN', 'общий_ADJ', 'дополнительный_ADJ', 'образование_NOUN', 'муниципальный_ADJ', 'региональный_ADJ', 'всероссийский_ADJ', 'мероприятие_NOUN', 'фестиваль_NOUN', 'конкурс_NOUN', 'соревнование_NOUN', 'олимпиада_NOUN', 'мастер-класс_NOUN', 'мероприятие_NOUN', 'выявление_NOUN', 'одаренность_NOUN', 'ребенок_NOUN', 'различный_ADJ', 'область_NOUN', 'интеллектуальный_ADJ', 'творческий_ADJ', 'деятельность_NOUN']",-1
206,СРЕДНЕМЕСЯЧНАЯ НОМИНАЛЬНАЯ НАЧИСЛЕННАЯ ЗАРАБОТНАЯ ПЛАТА РАБОТНИКОВ МУНИЦИПАЛЬНЫХ УЧРЕЖДЕНИЙ ДОПОЛНИТЕЛЬНОГО ОБРАЗОВАНИЯ,"['среднемесячный_ADJ', 'номинальный_ADJ', 'начисление_NOUN', 'заработный_ADJ', 'плата_NOUN', 'работник_NOUN', 'муниципальный_ADJ', 'учреждение_NOUN', 'дополнительный_ADJ', 'образование_NOUN']",8
232,ДОЛЯ УЧАЩИХСЯ ЗАНИМАЮЩИХСЯ В ОРГАНИЗАЦИЯХ ДОПОЛНИТЕЛЬНОГО ОБРАЗОВАНИЯ ДЕТЕЙ,"['доля_NOUN', 'учащийся_NOUN', 'заниматься_VERB', 'организация_NOUN', 'дополнительный_ADJ', 'образование_NOUN', 'ребенок_NOUN']",29
238,УДЕЛЬНЫЙ ВЕС ЧИСЛА ОБРАЗОВАТЕЛЬНЫХ ОРГАНИЗАЦИЙ ОБЩЕГО И ДОПОЛНИТЕЛЬНОГО ОБРАЗОВАНИЯ В КОТОРЫХ СОЗДАНЫ ОРГАНЫ КОЛЛЕГИАЛЬНОГО УПРАВЛЕНИЯ С УЧАСТИЕМ ОБЩЕСТВЕННОСТИ РОДИТЕЛИ ЗАКОННЫЕ ПРЕДСТАВИТЕЛИ РАБОТОДАТЕЛИ В ОБЩЕМ ЧИСЛЕ ОБРАЗОВАТЕЛЬНЫХ ОРГАНИЗАЦИЙ ИСПОЛЬЗУЮЩИЕ В ОСНОВЕ ВЫРАБОТКИ УПРАВЛЕНЧЕСКИХ РЕШЕНИЙ РЕЗУЛЬТАТЫ ОЦЕНКИ КАЧЕСТВА ОБРАЗОВАНИЯ,"['удельный_ADJ', 'вес_NOUN', 'число_NOUN', 'образование_NOUN', 'организация_NOUN', 'общий_ADJ', 'дополнительный_ADJ', 'образование_NOUN', 'который_DET', 'создавать_VERB', 'орган_NOUN', 'коллегиальный_ADJ', 'управление_NOUN', 'участие_NOUN', 'общественность_NOUN', 'родитель_NOUN', 'закон_NOUN', 'представитель_NOUN', 'работодатель_NOUN', 'общий_ADJ', 'число_NOUN', 'образование_NOUN', 'организация_NOUN', 'пользование_NOUN', 'основа_NOUN', 'выработка_NOUN', 'управленческий_ADJ', 'решение_NOUN', 'результат_NOUN', 'оценка_NOUN', 'качество_NOUN', 'образование_NOUN']",-1
275,УВЕЛИЧЕНИЕ КОЛИЧЕСТВА ДЕТЕЙ ПОЛУЧАЮЩИХ ДОПОЛНИТЕЛЬНОЕ ОБРАЗОВАНИЕ,"['увеличение_NOUN', 'количество_NOUN', 'ребенок_NOUN', 'получение_NOUN', 'дополнительный_ADJ', 'образование_NOUN']",23
328,ДОЛЯ НАСЕЛЕНИЯ УЧАСТВУЮЩЕГО В КОЛЛЕКТИВАХ НАРОДНОГО ТВОРЧЕСТВА И ШКОЛАХ ИСКУССТВ,"['доля_NOUN', 'население_NOUN', 'участвующий_NOUN', 'коллектив_NOUN', 'народ_NOUN', 'творчество_NOUN', 'школа_NOUN', 'искусство_NOUN']",-1
333,ОТНОШЕНИЕ СРЕДНЕМЕСЯЧНОЙ ЗАРАБОТНОЙ ПЛАТЫ ПЕДАГОГИЧЕСКИХ РАБОТНИКОВ МУНИЦИПАЛЬНЫХ ОБРАЗОВАТЕЛЬНЫХ ОРГАНИЗАЦИЙ ДОПОЛНИТЕЛЬНОГО ОБРАЗОВАНИЯ К СРЕДНЕЙ ЗАРАБОТНОЙ ПЛАТЕ В ЭКОНОМИКЕ РЕГИОНА,"['отношение_NOUN', 'среднемесячный_ADJ', 'заработный_ADJ', 'плата_NOUN', 'педагогический_ADJ', 'работник_NOUN', 'муниципальный_ADJ', 'образование_NOUN', 'организация_NOUN', 'дополнительный_ADJ', 'образование_NOUN', 'среднее_NOUN', 'заработный_ADJ', 'плата_NOUN', 'экономика_NOUN', 'регион_NOUN']",-1
401,ФОНД ЗАРАБОТНОЙ ПЛАТЫ ПЕДАГОГИЧЕСКИХ РАБОТНИКОВ ОРГАНИЗАЦИЙ ДОПОЛНИТЕЛЬНОГО ОБРАЗОВАНИЯ ДЕТЕЙ В ОРГАНИЗАЦИЯХ ОБРАЗОВАНИЯ,"['фонд_NOUN', 'заработный_ADJ', 'плата_NOUN', 'педагогический_ADJ', 'работник_NOUN', 'организация_NOUN', 'дополнительный_ADJ', 'образование_NOUN', 'ребенок_NOUN', 'организация_NOUN', 'образование_NOUN']",12
404,СРЕДНЕСПИСОЧНАЯ ЧИСЛЕННОСТЬ ПЕДАГОГИЧЕСКИХ РАБОТНИКОВ ОРГАНИЗАЦИЙ ДОПОЛНИТЕЛЬНОГО ОБРАЗОВАНИЯ ДЕТЕЙ В УЧРЕЖДЕНИЯХ КУЛЬТУРЫ,"['среднесписочный_ADJ', 'численность_NOUN', 'педагогический_ADJ', 'работник_NOUN', 'организация_NOUN', 'дополнительный_ADJ', 'образование_NOUN', 'ребенок_NOUN', 'учреждение_NOUN', 'культура_NOUN']",10
405,СРЕДНЕСПИСОЧНАЯ ЧИСЛЕННОСТЬ ПЕДАГОГИЧЕСКИХ РАБОТНИКОВ ОРГАНИЗАЦИЙ ДОПОЛНИТЕЛЬНОГО ОБРАЗОВАНИЯ ДЕТЕЙ В ОРГАНИЗАЦИЯХ ОБРАЗОВАНИЯ,"['среднесписочный_ADJ', 'численность_NOUN', 'педагогический_ADJ', 'работник_NOUN', 'организация_NOUN', 'дополнительный_ADJ', 'образование_NOUN', 'ребенок_NOUN', 'организация_NOUN', 'образование_NOUN']",10
406,ТЕМП РОСТА СРЕДНЕСПИСОЧНОЙ ЧИСЛЕННОСТИ ПЕДАГОГИЧЕСКИХ РАБОТНИКОВ ОРГАНИЗАЦИЙ ДОПОЛНИТЕЛЬНОГО ОБРАЗОВАНИЯ ДЕТЕЙ,"['темп_NOUN', 'рост_NOUN', 'среднесписочный_ADJ', 'численность_NOUN', 'педагогический_ADJ', 'работник_NOUN', 'организация_NOUN', 'дополнительный_ADJ', 'образование_NOUN', 'ребенок_NOUN']",5
407,ФОНД ЗАРАБОТНОЙ ПЛАТЫ ПЕДАГОГИЧЕСКИХ РАБОТНИКОВ ОРГАНИЗАЦИЙ ДОПОЛНИТЕЛЬНОГО ОБРАЗОВАНИЯ ДЕТЕЙ В УЧРЕЖДЕНИЯХ КУЛЬТУРЫ,"['фонд_NOUN', 'заработный_ADJ', 'плата_NOUN', 'педагогический_ADJ', 'работник_NOUN', 'организация_NOUN', 'дополнительный_ADJ', 'образование_NOUN', 'ребенок_NOUN', 'учреждение_NOUN', 'культура_NOUN']",12
479,ДОЛЯ ПЕДАГОГИЧЕСКИХ РАБОТНИКОВ ИМЕЮЩИХ ПЕРВУЮ И ВЫСШУЮ КВАЛИФИЦИРОВАННЫЕ КАТЕГОРИИ В ОБЩЕЙ ДОЛЕ ПЕДАГОГИЧЕСКИХ РАБОТНИКОВ МУНИЦИПАЛЬНЫХ ОРГАНИЗАЦИЙ ДОПОЛНИТЕЛЬНОГО ОБРАЗОВАНИЯ БЫКОВСКОГО МУНИЦИПАЛЬНОГО РАЙОНА,"['доля_NOUN', 'педагогический_ADJ', 'работник_NOUN', 'иметь_VERB', 'первый_ADJ', 'высокий_ADJ', 'квалифицированный_ADJ', 'категория_NOUN', 'общий_ADJ', 'доля_NOUN', 'педагогический_ADJ', 'работник_NOUN', 'муниципальный_ADJ', 'организация_NOUN', 'дополнительный_ADJ', 'образование_NOUN', 'муниципальный_ADJ', 'район_NOUN']",-1
544,ОХВАТ ДЕТЕЙ В ВОЗРАСТЕ ЛЕТ ПРОГРАММАМИ ДОПОЛНИТЕЛЬНОГО ОБРАЗОВАНИЯ,"['охват_NOUN', 'ребенок_NOUN', 'возраст_NOUN', 'год_NOUN', 'программа_NOUN', 'дополнительный_ADJ', 'образование_NOUN']",42
556,УДЕЛЬНЫЙ ВЕС ДЕТЕЙ И МОЛОДЕЖИ В ВОЗРАСТЕ ЛЕТ ОХВАЧЕННЫХ ПРОГРАММАМИ ДОПОЛНИТЕЛЬНОГО ОБРАЗОВАНИЯ,"['удельный_ADJ', 'вес_NOUN', 'ребенок_NOUN', 'молодежь_NOUN', 'возраст_NOUN', 'год_NOUN', 'охватывать_VERB', 'программа_NOUN', 'дополнительный_ADJ', 'образование_NOUN']",43
577,ДОЛЯ ДЕТЕЙ В ВОЗРАСТЕ ЛЕТ С ОГРАНИЧЕННЫМИ ВОЗМОЖНОСТЯМИ ЗДОРОВЬЯ ПОЛУЧАЮЩИХ УСЛУГИ ПО ДОПОЛНИТЕЛЬНОМУ ОБРАЗОВАНИЮ В ОРГАНИЗАЦИЯХ РАЗЛИЧНОЙ ОРГАНИЗАЦИОННО ПРАВОВОЙ ФОРМЫ И ФОРМЫ СОБСТВЕННОСТИ В ОБЩЕЙ ЧИСЛЕННОСТИ ДЕТЕЙ С ОГРАНИЧЕННЫМИ ВОЗМОЖНОСТЯМИ ЗДОРОВЬЯ ЭТОЙ ВОЗРАСТНОЙ ГРУППЫ,"['доля_NOUN', 'ребенок_NOUN', 'возраст_NOUN', 'год_NOUN', 'ограниченный_ADJ', 'возможность_NOUN', 'здоровье_NOUN', 'получение_NOUN', 'услуга_NOUN', 'дополнительный_ADJ', 'образование_NOUN', 'организация_NOUN', 'различный_ADJ', 'организационно_ADV', 'правый_NOUN', 'форма_NOUN', 'форма_NOUN', 'собственность_NOUN', 'общий_ADJ', 'численность_NOUN', 'ребенок_NOUN', 'ограниченный_ADJ', 'возможность_NOUN', 'здоровье_NOUN', 'возраст_NOUN', 'группа_NOUN']",13
609,КОЛИЧЕСТВО МУНИЦИПАЛЬНЫХ ОБРАЗОВАТЕЛЬНЫХ ОРГАНИЗАЦИЙ ОСНАЩЕННЫХ СОВРЕМЕННЫМ ОБОРУДОВАНИЕМ ДЛЯ РЕАЛИЗАЦИИ ПРОГРАММ ДОПОЛНИТЕЛЬНОГО ОБРАЗОВАНИЯ В РАМКАХ ПРОФОРИЕНТАЦИОННОЙ РАБОТЫ,"['количество_NOUN', 'муниципальный_ADJ', 'образование_NOUN', 'организация_NOUN', 'оснащение_NOUN', 'современный_ADJ', 'оборудование_NOUN', 'реализация_NOUN', 'программа_NOUN', 'дополнительный_ADJ', 'образование_NOUN', 'рамка_NOUN', 'профориентация_NOUN', 'работа_NOUN']",-1
615,СООТНОШЕНИЕ СРЕДНЕМЕСЯЧНОЙ ЗАРАБОТНОЙ ПЛАТЫ ПЕДАГОГИЧЕСКИХ РАБОТНИКОВ ОРГАНИЗАЦИЙ ДОПОЛНИТЕЛЬНОГО ОБРАЗОВАНИЯ ДЕТЕЙ К СРЕДНЕМЕСЯЧНОЙ ЗАРАБОТНОЙ ПЛАТЕ УЧИТЕЛЕЙ В СВЕРДЛОВСКОЙ ОБЛАСТИ,"['соотношение_NOUN', 'среднемесячный_ADJ', 'заработный_ADJ', 'плата_NOUN', 'педагогический_ADJ', 'работник_NOUN', 'организация_NOUN', 'дополнительный_ADJ', 'образование_NOUN', 'ребенок_NOUN', 'среднемесячный_ADJ', 'заработный_ADJ', 'плата_NOUN', 'учитель_NOUN', 'область_NOUN']",21
620,ДОЛЯ НЕСОВЕРШЕННОЛЕТНИХ ОХВАЧЕННЫХ КРУЖКАМИ И СЕКЦИЯМИ ДОСУГОМ ОТ ОБЩЕГО ЧИСЛА НЕСОВЕРШЕННОЛЕТНИХ,"['доля_NOUN', 'совершеннолетняя_NOUN', 'охватывать_VERB', 'кружка_NOUN', 'секция_NOUN', 'досуг_NOUN', 'общий_ADJ', 'число_NOUN', 'совершеннолетняя_NOUN']",-1
645,КАЧЕСТВЕННЫЙ ПОКАЗАТЕЛЬ УСПЕВАЕМОСТИ В ОРГАНИЗАЦИЯХ ДОПОЛНИТЕЛЬНОГО ОБРАЗОВАНИЯ СФЕРЫ КУЛЬТУРА,"['качество_NOUN', 'показатель_NOUN', 'успеваемость_NOUN', 'организация_NOUN', 'дополнительный_ADJ', 'образование_NOUN', 'сфера_NOUN', 'культура_NOUN']",-1
651,ДОЛЯ ДЕТЕЙ ШКОЛЬНОГО ВОЗРАСТА ОБУЧАЮЩИХСЯ ПО ДОПОЛНИТЕЛЬНЫМ ОБРАЗОВАТЕЛЬНЫМ ПРОГРАММАМ В ОБЩЕЙ ЧИСЛЕННОСТИ ДЕТЕЙ ЭТОГО ВОЗРАСТА,"['доля_NOUN', 'ребенок_NOUN', 'школьный_ADJ', 'возраст_NOUN', 'обученность_NOUN', 'дополнительный_ADJ', 'образование_NOUN', 'программа_NOUN', 'общий_ADJ', 'численность_NOUN', 'ребенок_NOUN', 'возраст_NOUN']",22
654,ДОЛЯ МУНИЦИПАЛЬНЫХ УЧРЕЖДЕНИЙ ДОПОЛНИТЕЛЬНОГО ОБРАЗОВАНИЯ МАТЕРИАЛЬНО ТЕХНИЧЕСКАЯ БАЗА КОТОРЫХ СООТВЕТСТВУЮТ ТРЕБОВАНИЯМ ОТ ОБЩЕГО КОЛИЧЕСТВА УЧРЕЖДЕНИЙ ДОПОЛНИТЕЛЬНОГО ОБРАЗОВАНИЯ,"['доля_NOUN', 'муниципальный_ADJ', 'учреждение_NOUN', 'дополнительный_ADJ', 'образование_NOUN', 'материально_ADV', 'технический_ADJ', 'база_NOUN', 'который_DET', 'ответственность_NOUN', 'требование_NOUN', 'общий_ADJ', 'количество_NOUN', 'учреждение_NOUN', 'дополнительный_ADJ', 'образование_NOUN']",-1
