0,1,2,3
7947,ДОЛЯ ОБУЧАЮЩИХСЯ УЧАСТВУЮЩИХ В РЕГИОНАЛЬНЫХ МЕЖДУНАРОДНЫХ МЕЖРЕГИОНАЛЬНЫХ ВСЕРОССИЙСКИХ ОЛИМПИАДАХ ТВОРЧЕСКИХ КОНКУРСАХ КОНФЕРЕНЦИЯХ СОРЕВНОВАНИЯХ И Т Д В РАМКАХ ОБЩЕГО И ДОПОЛНИТЕЛЬНОГО ОБРАЗОВАНИЯ,"['доля_NOUN', 'обучающийся_NOUN', 'участвующий_NOUN', 'региональный_ADJ', 'международный_ADJ', 'межрегиональный_ADJ', 'всероссийский_ADJ', 'олимпиада_NOUN', 'творческий_ADJ', 'конкурс_NOUN', 'конференция_NOUN', 'соревнование_NOUN', 'рамка_NOUN', 'общий_ADJ', 'дополнительный_ADJ', 'образование_NOUN']",-1
7969,ОХВАТ ДЕТЕЙ В ВОЗРАСТЕ ЛЕТ ПРОГРАММАМИ ДОПОЛНИТЕЛЬНОГО ОБРАЗОВАНИЯ УДЕЛЬНЫЙ ВЕС ЧИСЛЕННОСТИ ДЕТЕЙ ПОЛУЧАЮЩИХ УСЛУГИ ДОПОЛНИТЕЛЬНОГО ОБРАЗОВАНИЯ В ОБЩЕЙ ЧИСЛЕННОСТИ ДЕТЕЙ В ВОЗРАСТЕ ЛЕТ,"['охват_NOUN', 'ребенок_NOUN', 'возраст_NOUN', 'год_NOUN', 'программа_NOUN', 'дополнительный_ADJ', 'образование_NOUN', 'удельный_ADJ', 'вес_NOUN', 'численность_NOUN', 'ребенок_NOUN', 'получение_NOUN', 'услуга_NOUN', 'дополнительный_ADJ', 'образование_NOUN', 'общий_ADJ', 'численность_NOUN', 'ребенок_NOUN', 'возраст_NOUN', 'год_NOUN']",41
7996,УДЕЛЬНЫЙ ВЕС ЧИСЛЕННОСТИ ОБУЧАЮЩИХСЯ ПО ДОПОЛНИТЕЛЬНЫМ ОБРАЗОВАТЕЛЬНЫМ ПРОГРАММАМ УЧАСТВУЮЩИХ В ОЛИМПИАДАХ И КОНКУРСАХ РАЗЛИЧНОГО УРОВНЯ В ОБЩЕЙ ЧИСЛЕННОСТИ ОБУЧАЮЩИХСЯ ПО ДОПОЛНИТЕЛЬНЫМ ОБРАЗОВАТЕЛЬНЫМ ПРОГРАММАМ %,"['удельный_ADJ', 'вес_NOUN', 'численность_NOUN', 'обучающийся_NOUN', 'дополнительный_ADJ', 'образование_NOUN', 'программа_NOUN', 'участвующий_NOUN', 'олимпиада_NOUN', 'конкурс_NOUN', 'различный_ADJ', 'уровень_NOUN', 'общий_ADJ', 'численность_NOUN', 'обучающийся_NOUN', 'дополнительный_ADJ', 'образование_NOUN', 'программа_NOUN']",11
8005,ДОЛЯ ОБРАЗОВАТЕЛЬНЫХ ОРГАНИЗАЦИЙ ОСНОВНОГО И ДОПОЛНИТЕЛЬНОГО ОБРАЗОВАНИЯ УЧАСТВУЮЩИХ В ПОВЫШЕНИИ УРОВНЯ ФИНАНСОВОЙ ГРАМОТНОСТИ НАСЕЛЕНИЯ ОБЛАСТИ В ИХ ОБЩЕМ КОЛИЧЕСТВЕ,"['доля_NOUN', 'образование_NOUN', 'организация_NOUN', 'основание_NOUN', 'дополнительный_ADJ', 'образование_NOUN', 'участвующий_NOUN', 'повышение_NOUN', 'уровень_NOUN', 'финансовый_ADJ', 'грамотность_NOUN', 'население_NOUN', 'область_NOUN', 'общий_ADJ', 'количество_NOUN']",-1
8011,ОХВАТ ДЕТЕЙ В ВОЗРАСТЕ ЛЕТ ПРОГРАММАМИ ДОПОЛНИТЕЛЬНОГО ОБРАЗОВАНИЯ УДЕЛЬНЫЙ ВЕС ЧИСЛЕННОСТИ ДЕТЕЙ ПОЛУЧАЮЩИХ УСЛУГИ ДОПОЛНИТЕЛЬНОГО ОБРАЗОВАНИЯ В ОБЩЕЙ ЧИСЛЕННОСТИ ДЕТЕЙ В ВОЗРАСТЕ ЛЕТ,"['охват_NOUN', 'ребенок_NOUN', 'возраст_NOUN', 'год_NOUN', 'программа_NOUN', 'дополнительный_ADJ', 'образование_NOUN', 'удельный_ADJ', 'вес_NOUN', 'численность_NOUN', 'ребенок_NOUN', 'получение_NOUN', 'услуга_NOUN', 'дополнительный_ADJ', 'образование_NOUN', 'общий_ADJ', 'численность_NOUN', 'ребенок_NOUN', 'возраст_NOUN', 'год_NOUN']",41
8025,УДЕЛЬНЫЙ ВЕС ДЕТЕЙ В ВОЗРАСТЕ ОТ ДО ЛЕТ ПОЛУЧАЮЩИХ УСЛУГИ ПО ДОПОЛНИТЕЛЬНОМУ ОБРАЗОВАНИЮ В ОРГАНИЗАЦИЯХ РАЗЛИЧНОЙ ОРГАНИЗАЦИОННО ПРАВОВОЙ ФОРМЫ И ФОРМЫ СОБСТВЕННОСТИ,"['удельный_ADJ', 'вес_NOUN', 'ребенок_NOUN', 'возраст_NOUN', 'год_NOUN', 'получение_NOUN', 'услуга_NOUN', 'дополнительный_ADJ', 'образование_NOUN', 'организация_NOUN', 'различный_ADJ', 'организационно_ADV', 'правый_NOUN', 'форма_NOUN', 'форма_NOUN', 'собственность_NOUN']",25
8044,ДОЛЯ ДЕТЕЙ В ВОЗРАСТЕ ЛЕТ ПОЛУЧАЮЩИХ УСЛУГИ ПО ДОПОЛНИТЕЛЬНОМУ ОБРАЗОВАНИЮ В ОРГАНИЗАЦИЯХ РАЗЛИЧНОЙ ОРГАНИЗАЦИОННО ПРАВОВОЙ ФОРМЫ И ФОРМЫ СОБСТВЕННОСТИ В ОБЩЕЙ ЧИСЛЕННОСТИ ДЕТЕЙ ДАННОЙ ВОЗРАСТНОЙ ГРУППЫ,"['доля_NOUN', 'ребенок_NOUN', 'возраст_NOUN', 'год_NOUN', 'получение_NOUN', 'услуга_NOUN', 'дополнительный_ADJ', 'образование_NOUN', 'организация_NOUN', 'различный_ADJ', 'организационно_ADV', 'правый_NOUN', 'форма_NOUN', 'форма_NOUN', 'собственность_NOUN', 'общий_ADJ', 'численность_NOUN', 'ребенок_NOUN', 'данный_ADJ', 'возраст_NOUN', 'группа_NOUN']",24
8067,ДОЛЯ ДЕТЕЙ И МОЛОДЕЖИ В ВОЗРАСТЕ ЛЕТ ОХВАЧЕННЫХ ОБРАЗОВАТЕЛЬНЫМИ ПРОГРАММАМИ ДОПОЛНИТЕЛЬНОГО ОБРАЗОВАНИЯ,"['доля_NOUN', 'ребенок_NOUN', 'молодежь_NOUN', 'возраст_NOUN', 'год_NOUN', 'охватывать_VERB', 'образование_NOUN', 'программа_NOUN', 'дополнительный_ADJ', 'образование_NOUN']",43
8075,КОЛИЧЕСТВО ТВОРЧЕСКИХ НАУЧНЫХ ТЕХНИЧЕСКИХ СПОРТИВНЫХ И ДРУГИХ ОБЪЕДИНЕНИЙ ДОПОЛНИТЕЛЬНОГО ОБРАЗОВАНИЯ ДЕТЕЙ РАСПОЛОЖЕННЫХ НА ТЕРРИТОРИИ РАЙОНА,"['количество_NOUN', 'творческий_ADJ', 'научный_ADJ', 'технический_ADJ', 'спорт_NOUN', 'объединение_NOUN', 'дополнительный_ADJ', 'образование_NOUN', 'ребенок_NOUN', 'располагать_VERB', 'территория_NOUN', 'район_NOUN']",-1
8083,СРЕДНЕМЕСЯЧНАЯ ЗАРАБОТНАЯ ПЛАТА ПЕДАГОГИЧЕСКИХ РАБОТНИКОВ УЧРЕЖДЕНИЙ ДОПОЛНИТЕЛЬНОГО ОБРАЗОВАНИЯ ДЕТЕЙ,"['среднемесячный_ADJ', 'заработный_ADJ', 'плата_NOUN', 'педагогический_ADJ', 'работник_NOUN', 'учреждение_NOUN', 'дополнительный_ADJ', 'образование_NOUN', 'ребенок_NOUN']",-1
8088,ОХВАТ ДЕТЕЙ В ВОЗРАСТЕ ОТ ЛЕТ ОХВАЧЕННЫХ ОБРАЗОВАТЕЛЬНЫМИ ПРОГРАММАМИ ДОПОЛНИТЕЛЬНОГО ОБРАЗОВАНИЯ,"['охват_NOUN', 'ребенок_NOUN', 'возраст_NOUN', 'год_NOUN', 'охватывать_VERB', 'образование_NOUN', 'программа_NOUN', 'дополнительный_ADJ', 'образование_NOUN']",42
8096,ДОЛЯ ПЕДАГОГИЧЕСКИХ РАБОТНИКОВ ДОПОЛНИТЕЛЬНОГО ОБРАЗОВАНИЯ КОТОРЫМ ПРИ ПРОХОЖДЕНИИ АТТЕСТАЦИИ В СООТВЕТСТВУЮЩЕМ ГОДУ ПРИСВОЕНА ПЕРВАЯ ИЛИ ВЫСШАЯ КАТЕГОРИЯ,"['доля_NOUN', 'педагогический_ADJ', 'работник_NOUN', 'дополнительный_ADJ', 'образование_NOUN', 'который_DET', 'прохождение_NOUN', 'аттестация_NOUN', 'соответствие_NOUN', 'год_NOUN', 'присваивать_VERB', 'первый_ADJ', 'высокий_ADJ', 'категория_NOUN']",-1
8100,ОТНОШЕНИЕ СРЕДНЕМЕСЯЧНОЙ ЗАРАБОТНОЙ ПЛАТЫ ПЕДАГОГОВ МУНИЦИПАЛЬНЫХ ОРГАНИЗАЦИЙ ДОПОЛНИТЕЛЬНОГО ОБРАЗОВАНИЯ ДЕТЕЙ К СРЕДНЕМЕСЯЧНОЙ ЗАРАБОТНОЙ ПЛАТЕ В РЕГИОНЕ,"['отношение_NOUN', 'среднемесячный_ADJ', 'заработный_ADJ', 'плата_NOUN', 'педагог_NOUN', 'муниципальный_ADJ', 'организация_NOUN', 'дополнительный_ADJ', 'образование_NOUN', 'ребенок_NOUN', 'среднемесячный_ADJ', 'заработный_ADJ', 'плата_NOUN', 'регион_NOUN']",9
8106,СРЕДНЕМЕСЯЧНАЯ НОМИНАЛЬНАЯ НАЧИСЛЕННАЯ ЗАРАБОТНАЯ ПЛАТА РАБОТНИКОВ ОБРАЗОВАТЕЛЬНЫХ ОРГАНИЗАЦИЙ ДОПОЛНИТЕЛЬНОГО ОБРАЗОВАНИЯ ДЕТЕЙ ПОДВЕДОМСТВЕННЫХ МИНИСТЕРСТВУ ОБРАЗОВАНИЯ МОСКОВСКОЙ ОБЛАСТИ,"['среднемесячный_ADJ', 'номинальный_ADJ', 'начисление_NOUN', 'заработный_ADJ', 'плата_NOUN', 'работник_NOUN', 'образование_NOUN', 'организация_NOUN', 'дополнительный_ADJ', 'образование_NOUN', 'ребенок_NOUN', 'подведомственный_ADJ', 'министерство_NOUN', 'образование_NOUN', 'область_NOUN']",-1
8132,ТЕМП РОСТА ФОНДА ЗАРАБОТНОЙ ПЛАТЫ ПЕДАГОГИЧЕСКИХ РАБОТНИКОВ ОРГАНИЗАЦИЙ ДОПОЛНИТЕЛЬНОГО ОБРАЗОВАНИЯ ДЕТЕЙ,"['темп_NOUN', 'рост_NOUN', 'фонд_NOUN', 'заработный_ADJ', 'плата_NOUN', 'педагогический_ADJ', 'работник_NOUN', 'организация_NOUN', 'дополнительный_ADJ', 'образование_NOUN', 'ребенок_NOUN']",5
8187,ДОЛЯ ДЕТЕЙ В ВОЗРАСТЕ ЛЕТ ПОЛУЧАЮЩИХ УСЛУГИ ПО ДОПОЛНИТЕЛЬНОМУ ОБРАЗОВАНИЮ В МУНИЦИПАЛЬНЫХ ОБРАЗОВАТЕЛЬНЫХ ОРГАНИЗАЦИЯХ В ОБЩЕМ КОЛИЧЕСТВЕ ДЕТЕЙ ДАННОЙ ВОЗРАСТНОЙ ГРУППЫ,"['доля_NOUN', 'ребенок_NOUN', 'возраст_NOUN', 'год_NOUN', 'получение_NOUN', 'услуга_NOUN', 'дополнительный_ADJ', 'образование_NOUN', 'муниципальный_ADJ', 'образование_NOUN', 'организация_NOUN', 'общий_ADJ', 'количество_NOUN', 'ребенок_NOUN', 'данный_ADJ', 'возраст_NOUN', 'группа_NOUN']",27
8198,ОТНОШЕНИЕ СРЕДНЕМЕСЯЧНОЙ ЗАРАБОТНОЙ ПЛАТЫ ПЕДАГОГИЧЕСКИХ РАБОТНИКОВ МУНИЦИПАЛЬНЫХ ОРГАНИЗАЦИЙ ДОПОЛНИТЕЛЬНОГО ОБРАЗОВАНИЯ ДЕТЕЙ К СРЕДНЕЙ ЗАРАБОТНОЙ ПЛАТЕ В РЕГИОНЕ,"['отношение_NOUN', 'среднемесячный_ADJ', 'заработный_ADJ', 'плата_NOUN', 'педагогический_ADJ', 'работник_NOUN', 'муниципальный_ADJ', 'организация_NOUN', 'дополнительный_ADJ', 'образование_NOUN', 'ребенок_NOUN', 'среднее_NOUN', 'заработный_ADJ', 'плата_NOUN', 'регион_NOUN']",9
8203,ДОЛЯ ДЕТЕЙ В ВОЗРАСТЕ ОТ ДО ЛЕТ ОБУЧАЮЩИХСЯ ПО ДОПОЛНИТЕЛЬНЫМ ОБРАЗОВАТЕЛЬНЫМ ПРОГРАММАМ В ОБЩЕЙ ЧИСЛЕННОСТИ ДЕТЕЙ ЭТОГО ВОЗРАСТА,"['доля_NOUN', 'ребенок_NOUN', 'возраст_NOUN', 'год_NOUN', 'обученность_NOUN', 'дополнительный_ADJ', 'образование_NOUN', 'программа_NOUN', 'общий_ADJ', 'численность_NOUN', 'ребенок_NOUN', 'возраст_NOUN']",40
8206,ОТНОШЕНИЕ СРЕДНЕМЕСЯЧНОЙ ЗАРАБОТНОЙ ПЛАТЫ ПЕДАГОГИЧЕСКИХ РАБОТНИКОВ МУНИЦИПАЛЬНЫХ ОРГАНИЗАЦИЙ ДОПОЛНИТЕЛЬНОГО ОБРАЗОВАНИЯ ДЕТЕЙ ДО УРОВНЯ НЕ НИЖЕ СРЕДНЕГО ДЛЯ УЧИТЕЛЕЙ В МОСКОВСКОЙ ОБЛАСТИ,"['отношение_NOUN', 'среднемесячный_ADJ', 'заработный_ADJ', 'плата_NOUN', 'педагогический_ADJ', 'работник_NOUN', 'муниципальный_ADJ', 'организация_NOUN', 'дополнительный_ADJ', 'образование_NOUN', 'ребенок_NOUN', 'уровень_NOUN', 'низкий_ADJ', 'среднее_NOUN', 'учитель_NOUN', 'область_NOUN']",7
8214,ДОЛЯ НАСЕЛЕНИЯ СОВЕТСКОГО РАЙОНА ПОЛОЖИТЕЛЬНО ОЦЕНИВАЮЩАЯ КАЧЕСТВО ПРЕДОСТАВЛЯЕМЫХ УСЛУГ В СИСТЕМЕ ДОПОЛНИТЕЛЬНОГО ОБРАЗОВАНИЯ ДЕТЕЙ ОТ ОБЩЕГО КОЛИЧЕСТВА ОПРОШЕННОГО НАСЕЛЕНИЯ СОВЕТСКОГО РАЙОНА,"['доля_NOUN', 'население_NOUN', 'район_NOUN', 'положительно_ADV', 'оценивание_NOUN', 'качество_NOUN', 'предоставление_NOUN', 'услуга_NOUN', 'система_NOUN', 'дополнительный_ADJ', 'образование_NOUN', 'ребенок_NOUN', 'общий_ADJ', 'количество_NOUN', 'опрашивать_VERB', 'население_NOUN', 'район_NOUN']",-1
8220,ДОЛЯ ДЕТЕЙ ОХВАЧЕННЫХ ДОПОЛНИТЕЛЬНЫМ ОБРАЗОВАНИЕМ,"['доля_NOUN', 'ребенок_NOUN', 'охватывать_VERB', 'дополнительный_ADJ', 'образование_NOUN']",48
8221,ДОЛЯ ДЕТЕЙ ПОЛУЧАЮЩИХ ДОПОЛНИТЕЛЬНОЕ ОБРАЗОВАНИЕ РАЗЛИЧНЫХ НАПРАВЛЕННОСТЕЙ,"['доля_NOUN', 'ребенок_NOUN', 'получение_NOUN', 'дополнительный_ADJ', 'образование_NOUN', 'различный_ADJ', 'направленность_NOUN']",-1
8280,ДОЛЯ ВОСПИТАННИКОВ ОРГАНИЗАЦИЙ ДОПОЛНИТЕЛЬНОГО ОБРАЗОВАНИЯ УЧАСТВУЮЩИХ В КОНКУРСАХ СМОТРАХ ФЕСТИВАЛЯХ СОРЕВНОВАНИЯХ РАЗЛИЧНОГО УРОВНЯ В ОБЩЕЙ ЧИСЛЕННОСТИ ВОСПИТАННИКОВ,"['доля_NOUN', 'воспитанник_NOUN', 'организация_NOUN', 'дополнительный_ADJ', 'образование_NOUN', 'участвующий_NOUN', 'конкурс_NOUN', 'смотр_NOUN', 'фестиваль_NOUN', 'соревнование_NOUN', 'различный_ADJ', 'уровень_NOUN', 'общий_ADJ', 'численность_NOUN', 'воспитанник_NOUN']",-1
8305,ОХВАТ ШКОЛЬНИКОВ ЗАНИМАЮЩИХСЯ В СПОРТИВНЫХ КРУЖКАХ И СЕКЦИЯХ НА БАЗЕ СПОРТИВНЫХ ЗАЛОВ И ПЛОЩАДОК ОБРАЗОВАТЕЛЬНЫХ УЧРЕЖДЕНИЙ,"['охват_NOUN', 'школьник_NOUN', 'заниматься_VERB', 'спорт_NOUN', 'кружок_NOUN', 'секция_NOUN', 'база_NOUN', 'спорт_NOUN', 'зал_NOUN', 'площадка_NOUN', 'образование_NOUN', 'учреждение_NOUN']",-1
8316,ПОДПРОГРАММА РАЗВИТИЕ ДОПОЛНИТЕЛЬНОГО ОБРАЗОВАНИЯ В ОБЛАСТИ ИСКУССТВА ОСНОВНОЕ РАСХОДЫ НА ОБЕСПЕЧЕНИЕ ДЕЯТЕЛЬНОСТИ ОКАЗАНИЕ УСЛУГ МУНИЦИПАЛЬНЫХ УЧРЕЖДЕНИЙ,"['подпрограмма_NOUN', 'развитие_NOUN', 'дополнительный_ADJ', 'образование_NOUN', 'область_NOUN', 'искусство_NOUN', 'основание_NOUN', 'расход_NOUN', 'обеспечение_NOUN', 'деятельность_NOUN', 'оказание_NOUN', 'услуга_NOUN', 'муниципальный_ADJ', 'учреждение_NOUN']",-1
8332,ДОЛЯ ДЕТЕЙ ОТ ДО ЛЕТ ПОЛУЧАЮЩИХ УСЛУГИ ПО ДОПОЛНИТЕЛЬНОМУ ОБРАЗОВАНИЮ В ОБРАЗОВАТЕЛЬНЫХ УЧРЕЖДЕНИЯХ,"['доля_NOUN', 'ребенок_NOUN', 'год_NOUN', 'получение_NOUN', 'услуга_NOUN', 'дополнительный_ADJ', 'образование_NOUN', 'образование_NOUN', 'учреждение_NOUN']",45
8341,ДОЛЯ РУКОВОДИТЕЛЕЙ МУНИЦИПАЛЬНЫХ ОБРАЗОВАТЕЛЬНЫХ ОРГАНИЗАЦИЙ ДОПОЛНИТЕЛЬНОГО ОБРАЗОВАНИЯ ДЕТЕЙ С КОТОРЫМИ ЗАКЛЮЧЕНЫ ЭФФЕКТИВНЫЕ КОНТРАКТЫ,"['доля_NOUN', 'руководитель_NOUN', 'муниципальный_ADJ', 'образование_NOUN', 'организация_NOUN', 'дополнительный_ADJ', 'образование_NOUN', 'ребенок_NOUN', 'который_DET', 'заключенная_NOUN', 'эффект_NOUN', 'контракт_NOUN']",-1
8346,УДЕЛЬНЫЙ ВЕС МУНИЦИПАЛЬНЫХ УЧРЕЖДЕНИЙ ДОПОЛНИТЕЛЬНОГО ОБРАЗОВАНИЯ ДЕТЕЙ ДЛЯ КОТОРЫХ РАСЧЕТ СУБСИДИИ НА ВЫПОЛНЕНИЕ МУНИЦИПАЛЬНОГО ЗАДАНИЯ НА ОКАЗАНИЕ МУНИЦИПАЛЬНЫХ УСЛУГ ОСУЩЕСТВЛЯЕТСЯ НА ОСНОВЕ ЕДИНЫХ ГРУППОВЫХ ЗНАЧЕНИЙ НОРМАТИВНЫХ ЗАТРАТ С ИСПОЛЬЗОВАНИЕМ КОРРЕКТИРУЮЩИХ ПОКАЗАТЕЛЕЙ,"['удельный_ADJ', 'вес_NOUN', 'муниципальный_ADJ', 'учреждение_NOUN', 'дополнительный_ADJ', 'образование_NOUN', 'ребенок_NOUN', 'который_DET', 'расчет_NOUN', 'субсидия_NOUN', 'выполнение_NOUN', 'муниципальный_ADJ', 'задание_NOUN', 'оказание_NOUN', 'муниципальный_ADJ', 'услуга_NOUN', 'осуществляться_VERB', 'основа_NOUN', 'единый_ADJ', 'группа_NOUN', 'значение_NOUN', 'норматив_NOUN', 'затрата_NOUN', 'использование_NOUN', 'корректировать_VERB', 'показатель_NOUN']",-1
8360,УРОВЕНЬ УДОВЛЕТВОРЕННОСТИ НАСЕЛЕНИЯ РАЙОНА КАЧЕСТВОМ ДОПОЛНИТЕЛЬНОГО ОБРАЗОВАНИЯ,"['уровень_NOUN', 'удовлетворенность_NOUN', 'население_NOUN', 'район_NOUN', 'качество_NOUN', 'дополнительный_ADJ', 'образование_NOUN']",32
8392,УДОВЛЕТВОРЕННОСТЬ ПОТРЕБИТЕЛЕЙ РОДИТЕЛЕЙ И ДЕТЕЙ КАЧЕСТВОМ ОКАЗАНИЯ УСЛУГ ПО ПРЕДОСТАВЛЕНИЮ ДОПОЛНИТЕЛЬНОГО ОБРАЗОВАНИЯ ДЕТЕЙ,"['удовлетворенность_NOUN', 'потребитель_NOUN', 'родитель_NOUN', 'ребенок_NOUN', 'качество_NOUN', 'оказание_NOUN', 'услуга_NOUN', 'предоставление_NOUN', 'дополнительный_ADJ', 'образование_NOUN', 'ребенок_NOUN']",-1
8396,ДОЛЯ ДЕТЕЙ В ВОЗРАСТЕ ЛЕТ ПОЛУЧАЮЩИХ УСЛУГИ ПО ДОПОЛНИТЕЛЬНОМУ ОБРАЗОВАНИЮ В ОРГАНИЗАЦИЯХ РАЗЛИЧНОЙ ОРГАНИЗАЦИОННО ПРАВОВОЙ ФОРМЫ И ФОРМЫ СОБСТВЕННОСТИ В ОБЩЕЙ ЧИСЛЕННОСТИ ДЕТЕЙ ЭТОЙ ВОЗРАСТНОЙ ГРУППЫ,"['доля_NOUN', 'ребенок_NOUN', 'возраст_NOUN', 'год_NOUN', 'получение_NOUN', 'услуга_NOUN', 'дополнительный_ADJ', 'образование_NOUN', 'организация_NOUN', 'различный_ADJ', 'организационно_ADV', 'правый_NOUN', 'форма_NOUN', 'форма_NOUN', 'собственность_NOUN', 'общий_ADJ', 'численность_NOUN', 'ребенок_NOUN', 'возраст_NOUN', 'группа_NOUN']",25
8407,ДОЛЯ ДЕТЕЙ В ВОЗРАСТЕ ОТ ДО ЛЕТ ОБУЧАЮЩИХСЯ ПО ДОПОЛНИТЕЛЬНЫМ ОБРАЗОВАТЕЛЬНЫМ ПРОГРАММАМ В ОБЩЕЙ ЧИСЛЕННОСТИ ДЕТЕЙ ЭТОГО ВОЗРАСТА,"['доля_NOUN', 'ребенок_NOUN', 'возраст_NOUN', 'год_NOUN', 'обученность_NOUN', 'дополнительный_ADJ', 'образование_NOUN', 'программа_NOUN', 'общий_ADJ', 'численность_NOUN', 'ребенок_NOUN', 'возраст_NOUN']",40
8418,ДОЛЯ НАСЕЛЕНИЯ БУДЕНОВСКОГО МУНИЦИПАЛЬНОГО РАЙОНА УДОВЛЕТВОРЕННАЯ КАЧЕСТВОМ ДОПОЛНИТЕЛЬНОГО ОБРАЗОВАНИЯ,"['доля_NOUN', 'население_NOUN', 'буденовский_NOUN', 'муниципальный_ADJ', 'район_NOUN', 'удовлетворение_NOUN', 'качество_NOUN', 'дополнительный_ADJ', 'образование_NOUN']",-1
8423,КОЛИЧЕСТВО ОБУЧАЮЩИХСЯ В МУНИЦИПАЛЬНЫХ УЧРЕЖДЕНИЯХ ДОПОЛНИТЕЛЬНОГО ОБРАЗОВАНИЯ,"['количество_NOUN', 'обученность_NOUN', 'муниципальный_ADJ', 'учреждение_NOUN', 'дополнительный_ADJ', 'образование_NOUN']",40
8424,ДОЛЯ МУНИЦИПАЛЬНЫХ УЧРЕЖДЕНИЙ ДОПОЛНИТЕЛЬНОГО ОБРАЗОВАНИЯ СООТВЕТСТВУЮЩИХ ТРЕБОВАНИЯМ САН ОТ ОБЩЕГО КОЛИЧЕСТВА УЧРЕЖДЕНИЙ ДОПОЛНИТЕЛЬНОГО ОБРАЗОВАНИЯ,"['доля_NOUN', 'муниципальный_ADJ', 'учреждение_NOUN', 'дополнительный_ADJ', 'образование_NOUN', 'соответствие_NOUN', 'требование_NOUN', 'сан_NOUN', 'общий_ADJ', 'количество_NOUN', 'учреждение_NOUN', 'дополнительный_ADJ', 'образование_NOUN']",-1
8459,УДЕЛЬНЫЙ ВЕС ЧИСЛЕННОСТИ ОБУЧАЮЩИХСЯ ПО ДОПОЛНИТЕЛЬНЫМ ОБРАЗОВАТЕЛЬНЫМ ПРОГРАММАМ УЧАСТВУЮЩИХ В ОЛИМПИАДАХ И КОНКУРСАХ РАЗЛИЧНОГО УРОВНЯ В ОБЩЕЙ ЧИСЛЕННОСТИ ОБУЧАЮЩИХСЯ ПО ДОПОЛНИТЕЛЬНЫМ ОБРАЗОВАТЕЛЬНЫМ ПРОГРАММА,"['удельный_ADJ', 'вес_NOUN', 'численность_NOUN', 'обучающийся_NOUN', 'дополнительный_ADJ', 'образование_NOUN', 'программа_NOUN', 'участвующий_NOUN', 'олимпиада_NOUN', 'конкурс_NOUN', 'различный_ADJ', 'уровень_NOUN', 'общий_ADJ', 'численность_NOUN', 'обучающийся_NOUN', 'дополнительный_ADJ', 'образование_NOUN', 'программа_NOUN']",11
8464,ДОЛЯ ДЕТЕЙ В ВОЗРАСТЕ ЛЕТ ПОЛУЧАЮЩИХ УСЛУГИ ПО ДОПОЛНИТЕЛЬНОМУ ОБРАЗОВАНИЮ В ОРГАНИЗАЦИЯХ РАЗЛИЧНОЙ ОРГАНИЗАЦИОННО ПРАВОВОЙ ФОРМЫ И ФОРМЫ СОБСТВЕННОСТИ В ОБЩЕЙ ЧИСЛЕННОСТИ ДЕТЕЙ ДАННОЙ ВОЗРАСТНОЙ ГРУППЫ,"['доля_NOUN', 'ребенок_NOUN', 'возраст_NOUN', 'год_NOUN', 'получение_NOUN', 'услуга_NOUN', 'дополнительный_ADJ', 'образование_NOUN', 'организация_NOUN', 'различный_ADJ', 'организационно_ADV', 'правый_NOUN', 'форма_NOUN', 'форма_NOUN', 'собственность_NOUN', 'общий_ADJ', 'численность_NOUN', 'ребенок_NOUN', 'данный_ADJ', 'возраст_NOUN', 'группа_NOUN']",24
8482,ДОЛЯ ОБУЧАЮЩИХСЯ УЧАСТВУЮЩИХ В РЕГИОНАЛЬНЫХ МЕЖДУНАРОДНЫХ МЕЖРЕГИОНАЛЬНЫХ ВСЕРОССИЙСКИХ ОЛИМПИАДАХ ТВОРЧЕСКИХ КОНКУРСАХ КОНФЕРЕНЦИЯХ СОРЕВНОВАНИЯХ И Т Д В РАМКАХ ОБЩЕГО И ДОПОЛНИТЕЛЬНОГО ОБРАЗОВАНИЯ,"['доля_NOUN', 'обучающийся_NOUN', 'участвующий_NOUN', 'региональный_ADJ', 'международный_ADJ', 'межрегиональный_ADJ', 'всероссийский_ADJ', 'олимпиада_NOUN', 'творческий_ADJ', 'конкурс_NOUN', 'конференция_NOUN', 'соревнование_NOUN', 'рамка_NOUN', 'общий_ADJ', 'дополнительный_ADJ', 'образование_NOUN']",-1
